filename,external,worldcat,objectid,format,display_template,image_thumb,image_small,date,creator,title,subject,abstract,synopsis,description,classification,genre,publisher,journal,university,address,country,latitude,longitude
Camargo_DT_Pessoas.pdf,,,camargo_dt_pessoas,application/pdf,pdf,/objects/thumbs/camargo_dt_pessoas_th.jpg,,2020,Eric Seger de Camargo,Pessoas trans nos esportes: os jogos da cisnormatividade,Educação; Esporte; Cisgeneridade,"A crescente presença e progressiva visibilidade de pessoas trans no esporte suscita discussões sobre a equidade competitiva entre pessoas trans e pessoas cis. Educadores/as, treinadores/as e gestores/as do esporte precisam tomar decisões a respeito da inclusão de pessoas trans no esporte baseado em critérios científicos e sociais. As controvérsias envolvendo essa questão tomam como referência os parâmetros corporais “sexo biológico” como forma de comparar pessoas trans a pessoas cis e promover condições “justas” de competição. Com o objetivo de compor uma base teórica de análise para compreender essa questão, essa pesquisa analisou a produção científica de especialistas envolvidos no consenso do Comitê Olímpico Internacional sobre pessoas trans para situar a discussão em uma lente de análise consciente da cisnormatividade, do racismo e do colonialismo, entendendo como que a produção científica produz os critérios de eligibilidade das categorias feminina e masculina no esporte. A metodologia envolveu o levantamento de produções científicas associadas a questão que delineassem as epistemologias de corpos envolvidas na decisão apresentada pelo consenso. As ferramentas teóricas utilizadas para compreender essas bases epistemológicas foram a cisnormatividade a partir de Viviane Vergueiro, a performatividade de gênero/sexo proposta por Butler, e a praxiografia de Annemarie Mol, que juntas buscaram ampliar as possibilidades de inteligibilidade de corpos para entender os limites e pontos cegos envolvidos na determinação de critérios fisiológicos das diferenças sexuais. A associação das diferenças sexuais com hormônios (especificamente testosterona) e desempenhos esportivos proporcionalmente correspondentes ao binário sexual foi identificada como o paradigma atual de compreensão do sexo biológico. A primazia da testosterona como fator único e suficiente para predição de desempenho é contestada por diversos/as autores/as, alimentando controvérsias que se associam à questão das pessoas trans. A inteligibilidade dos corpos trans aparece limitada ao espelho da cisgeneridade, sendo definida a partir da noção de uma essência cisgênera modificada por hormônios, buscando-se assim a equivalência a essa referência, reduzindo as possibilidades de existências trans. A raça é uma variável central que é naturalizada na produção de um referencial branco universal, invisibilizando os mecanismos de conformação de gênero que penalizam mais frequentemente as pessoas negras, já que o referencial gendrado está associado à branquitude. As condições justas de competição envolvendo pessoas trans não devem ser limitadas a discussões sobre testosterona, e sim ampliar o referencial de compreensão sobre pessoas trans incluindo a percepção de como atuam os mecanismos de exclusão social. Não existem até o momento evidências significativas que apontem vantagens injustas de mulheres trans sobre mulheres cis em competições esportivas.",,,Teses e Dissertações,Dissertação (Mestrado),,,UFRGS,,Brazil,-30.03367535,-51.21913413
Reidel_DT_Pedagogia.pdf,,,reidel_dt_pedagogia,application/pdf,pdf,/objects/thumbs/reidel_dt_pedagogia_th.jpg,,2013,Marina Reidel,A pedagogia do salto alto. Histórias de professoras transexuais e travestis na educação brasileira,Educação; Travestilidades; Subjetividade,"O presente trabalho de pesquisa traz uma nova abordagem e novos personagens dentro do contexto educacional. A pedagogia do salto alto é uma nova leitura que traz as histórias de professoras transexuais e travestis atuantes na educação brasileira como personagens que, por muito tempo, ficaram escondidas ou à margem da sociedade. A partir das histórias de vida apresentadas, analiso tópicos importantes e significativos, norteando o tema da Educação, transversalizando com outros temas como sexualidade, gênero, violência e preconceito. Também proponho, neste trabalho, apontar alguns caminhos possíveis na busca de uma educação possível, a partir destes novos sujeitos",,,Teses e Dissertações,Dissertação (Mestrado),,,UFRGS,,Brazil,-30.03367535,-51.21913413
Braz_DT_Hair.pdf,,,braz_dt_hair,application/pdf,pdf,/objects/thumbs/braz_dt_hair_th.jpg,,2024,Emília Braz,Hair is Everything: Materializando a cisgeneridade a partir dos pelos corporais,Cisgeneridade; Materialidades; Estudos feministas de ciência; Feminismos,"Fonte de debates ético-onto-epistêmicos (Barad, 2007), o conceito de cisgeneridade se tornou fundamental na compreensão da construção de fronteiras de sexo e gênero, assim como de raça e humanidade, e seus efeitos políticos. No Brasil, o conceito é uma das principais articulações transfeministas, se popularizando como a nomeação de pessoas que mantém o gênero designado no nascimento. Visando problematizar a ideia de gênero, sexo, raça e humanidade como atributos e características inerentes e meramente discursivos, volto-me à materialização da cisgeneridade a partir de uma característica sexual secundária: os pelos corporais. Articulando os estudos feministas e sociais da ciência e os estudos trans em uma cama de gato (Haraway, 1994; 2023a), proponho contar outra história/estória do conceito de cisgeneridade a partir do seguinte questionamento: pode uma mulher trans ser diagnosticada com hirsutismo? Baseando me na noção de práticas material-discursivas (Haraway, 2023b; Barad, 2007) e na especulação fabulativa do conhecimento científico (Haraway, 2023b; 1996; M'charek, 2013), compreendo a cisgeneridade não como a constatação do dimorfismo sexual como a realidade dos corpos, mas como o aparato de produção corporal através do qual corpos cis e trans são diferencial e relativamente construídos.",,,Teses e Dissertações,Dissertação (Mestrado),,,UFRGS,,Brazil,-30.03367535,-51.21913413
Neves_DT_Hospitalidade.pdf,,,neves_dt_hospitalidade,application/pdf,pdf,/objects/thumbs/neves_dt_hospitalidade_th.jpg,,2015,Benjamin Neves,Transmasculinidades e o cuidado em saúde: desafios e impasses por vidas não fascistas,Saúde; Transmasculinidades,,,,Teses e Dissertações,Dissertação (Mestrado),,,UFRJ,,Brazil,-22.86676884,-43.21520495
Pfeil_DT_Critica.pdf,,,pfeil_dt_critica,application/pdf,pdf,/objects/thumbs/pfeil_dt_critica_th.jpg,,2023,Cello Latini Pfeil,Uma crítica à cisnormatividade pelas perspectivas decolonial e anarquista,Filosofia; Cisgeneridade; Decolonialidade; Anarquismo,"Na presente pesquisa, nos interessamos em investigar como o estabelecimento da
cisgeneridade enquanto norma se relaciona com a colonialidade e com a autoridade que
estruturam os espaços de poder e de produção de conhecimento. Uma vez assumindo que o
colonialismo – e, com ele, a normatização da cisgeneridade – teve como precursor as forças
militares e administrativas dos Estados europeus, pensaremos como instâncias
governamentais – sistemas jurídico, educacional e de saúde, burocracias cartoriais, forças
policiais – exercem a manutenção da colonialidade, no que diz respeito a corpos trans. A
originalidade da pesquisa advém da lacuna que há nas perspectivas anarquistas e decoloniais
em estudos sobre transgeneridade e cisgeneridade. A partir de referenciais teóricos
anarquistas e decoloniais, avaliaremos como ambas as perspectivas se entrelaçam ao
analisarmos as violências cisnormativas direcionadas a corpos trans. Nesse sentido,
direcionamos a pesquisa a partir de três hipóteses principais: 1) De que pessoas trans são alvo
de violências cisheteronormativas, instituídas pela modernidade/colonialidade; 2) De que os
movimentos sociais de pessoas trans refletem, em sua organização, os princípios
fundamentais anarquistas de emancipação; 3) De que a análise desses movimentos e das
violências é capaz de demonstrar como as perspectivas decolonial e anarquista são
complementares entre si; 4) De que há uma lacuna, tanto no anarquismo como na
decolonialidade, em relação a estudos sobre transgeneridade e cisgeneridade. Ademais,
propomos o conceito de colonialidade cisgênera como uma forma de colonialidade específica
da cisnormatividade, e que aflige diretamente os corpos trans. Para comprovar tais hipóteses,
utilizamos, como nossa metodologia, análise bibliográfica e discussão teórica, assim como
análise de dados sobre as violências contra pessoas trans. Os dados, em sua maioria, se
concentram no contexto brasileiro, a partir da segunda década do século XXI. Já o recorte
conceitual de tais estudos de gênero, que abarcam a história da cisgeneridade e da
transgeneridade enquanto conceitos, data da segunda metade do século XX.",,,Teses e Dissertações,Dissertação (Mestrado),,,UFRJ,,Brazil,-22.86676884,-43.21520495
Oliveira_DT_Somos.pdf,,,oliveira_dt_somos,application/pdf,pdf,/objects/thumbs/oliveira_dt_somos_th.jpg,,2015,André Lucas Guerreiro Oliveira,Somos quem podemos ser: os homens (trans) brasileiros e o discurso pela (des)patologização da transexualidade,Ciências Sociais; Transmasculinidades; Saúde,"Esta pesquisa buscou analisar o discurso dos homens (trans) brasileiros em relação à (des) patologização das identidades (trans). Para tanto, buscou-se analisar a percepção dos sentidos atribuídos pelos homens (trans) brasileiros às suas experiências inseridas no contexto em que sua vivência é considerada uma patologia psiquiátrica, passível (ou não) de ser laudada por profissionais das áreas médica e psicológica. De tal maneira que, a obtenção deste parecer torna-se obrigatório para a realização de alterações corporais, bem como aos encaminhamentos para as modificações da documentação civil. A metodologia adotada foi a análise de discurso e as técnicas de pesquisa foram entrevistas semiestruturadas e observação sistemática das reuniões do grupo Cartografias Trans, grupo de atendimento psicoterápico à pessoas (trans) do Centro de pesquisa e atendimento à travestis e transexuais – CPATT em Curitiba, Paraná. O referencial teórico da pesquisa apoiou-se principalmente, mas não apenas, nos estudos propostos pela teoria queer. Nesse sentido a pesquisa verificou a partir da inserção no campo e da análise que os dados trouxeram, dentre outras questões, a existência de um discurso estratégico por parte dos homens (trans) brasileiros em relação à despatologização de suas identidades, manifestado principalmente na noção de que ter a identidade (trans) patologizada não os torna doentes.",,,Teses e Dissertações,Dissertação (Mestrado),,,UFRN,,Brazil,-5.83942619,-35.20048149
Paiva_DT_Travas.pdf,,,paiva_dt_travas,application/pdf,pdf,/objects/thumbs/paiva_dt_travas_th.jpg,,2020,Pietra Azevedo Paiva,“As travas de Jardim são unidas”: etnografia da performance identitária das travestis em contextos rurais,Antropologia; Contextos rurais; Ciências Sociais,"As pesquisas sobre travestilidades apresentam majoritariamente um locus urbano e metropolitano para a performance identitária das travestis, pouco conhecendo as performatizações em outros contextos, como os rurais e interioranos. Por via etnográfica, acompanhei cotidianamente, com alguns intervalos, cinco travestis entre fevereiro e setembro de 2019 em um município rural/interiorano do sertão norte-rio-grandense, buscando problematizar e compreender como elas performatizam suas identidades de gênero e constroem seus corpos e subjetividades. Para isso, refleti sobre a fluidez e descentramento destas performances identitárias no manejo dos símbolos, das formas de tratamento e dos espaços generificados; e analisei, no âmbito da alteridade, as visibilidades sociais e as sociabilidades construídas/presentes nos cotidianos observados, tendo como base os marcadores sociais da diferença de classe, deficiência, geração e raça. De um lado, compreende-se as agências e a diversidade envoltas das travestilidades, corroborando na expansão do mosaico e do caleidoscópio das travestilidades brasileiras e nordestinas, e evidenciando a heterogeneidade a partir dos marcadores diferenciados de subjetivação e de deslocamentos. Por outro, desmistifica-se o Nordeste e seus interiores [rurais] como “atrasados” e locus da moralidade conservadora e repressora, e problematiza-se a geometria dos espaços, que socioculturalmente propaga e defende a hierarquia do urbano/metropolitano “civilizado” sobre o rural/interiorano “primitivo”, alegando a recognição das cidades como lugares de trânsitos, onde os municípios urbanos ou rurais estão interligados pelos deslocamentos multilaterais, colocando em questão a essencialização e a binariedade do rural, urbano, interior e metrópole.",,,Teses e Dissertações,Dissertação (Mestrado),,,UFRN,,Brazil,-5.83942619,-35.20048149
Souza_DT_Entre.pdf,,,souza_dt_entre.pdf,application/pdf,pdf,/objects/thumbs/souza_dt_entre_th.jpg,,2023,Nina Acacio Oliveira de Souza,"Entre o seco, o molhado e o urbano na Amazônia: uma etnografia sobre palafitas, meus parentes e áreas de ressaca em Santana, Amapá",Antropologia; Antropologia Urbana; Áreas de Ressaca; Ciências Sociais,"Viver entre palafitas, cursos d?água e a cidade é um desafio cotidiano, como também uma forma de fazer-cidade, fazer-vizinhança e de se fazer-vida. Nessa dissertação, são explorados etnograficamente o que significam esses desafios em termos de práticas cotidianas e modos de relação entre sujeitos, suas casas e demais agentes. Com enfoque em uma vizinhança específica, entre os bairros Comercial e Hospitalidade, na cidade de Santana, Amapá, trata-se das histórias que pululam entre dinâmicas diversas de socialidade de uma antropóloga em formação. Ao analisar, a partir de moradores tidos como antigos ou veteranos, pode-se pensar como é organizado um modo de relacionamento com a cidade, suas águas e a urbanização. Exploraram-se as histórias de vida de interlocutoras/es e sua aproximação intrínseca com que a pesquisadora e suas próprias redes afetivas, de parentesco e familiaridade. Buscando um diálogo entre diferentes abordagens etnográficas e agentes envolvidos nas dinâmicas constantes da urbanização, pode-se analisar, interpretar e produzir, de certo modo, uma dissertação em que se devaneia sobre a urbanização como devir e sua relação com as pessoas e suas formas de morar, a partir da produção de uma tessitura de vida em que a materialização da casa transcende suas próprias relações. Grosso modo, casas, pessoas, parentes e aparentados constroem de forma mútua nas linhas que desaguam em águas às margens de um grande rio na Amazônia",,,Teses e Dissertações,Dissertação (Mestrado),,,UFSC,,Brazil,-26.88663712,-49.11222104
Araujo_DT_Fecundacoes.pdf,,,araujo_dt_fecundacoes,application/pdf,pdf,/objects/thumbs/araujo_dt_fecundacoes_th.jpg,,2019,Bru Pereira de Araujo,Fecundações cruzadas: gêneros ameríndios e incursões antropológicas,Ciências Sociais; Antropologia; Ameríndios,,,,Teses e Dissertações,Dissertação (Mestrado),,,UNESP,,Brazil,-20.51026337,-47.38596473
Costa_DT_Identidade.pdf,,,costa_dt_identidade,application/pdf,pdf,/objects/thumbs/costa_dt_identidade_th.jpg,,2020,Hainra Asabi Alves Costa,Identidade racial e transexual: um olhar sobre os PNLD de sociologia,Ciências Sociais; Sociologia; Raça; Identidade,"O presente trabalho de estudo tem por objetivo realizar as análises quantitativas dos livros didáticos do PNLD 2018 de Sociologia, em suas cinco publicações, a partir de um recorte das identidades racial e transexual, da leitura dos textos carregados da temática em questão. Para produção dos dados levamos da ferramenta de pesquisa presente no software Adobe Acrobat Reader DC, aplicando um conjunto de palavras relacionadas ao tema, separadas entre raça e travestilidade. Para a identificação dos textos, imagens, tabelas e gráficos que tratassem a questão racial utilizamos os verbetes: raça, negro e preto. Já para localizar textos, imagens, tabelas e gráficos relacionadas as questões da identidade travesti, fiquemos uso das palavras: transsual, transgêro (a) e transexual. Após identificar as palavras chave uma a uma, passamos a ler o conteúdo e contexto ao qual a palavra chave se encontrava, afim de verificar o enquadramento de nosso objeto. Na sequência análise dos dados, bem como apresentamos ao longo desta dissertação.",,,Teses e Dissertações,Dissertação (Mestrado),,,UNESP,,Brazil,-20.51026337,-47.38596473
Bagagli_DT_Discursos.pdf,,,bagagli_dt_discursos,application/pdf,pdf,/objects/thumbs/bagagli_dt_discursos_th.jpg,,2019,Beatriz Bagagli,Discursos de transfemininas e feministas radicais: disputas pela significação da mulher no feminismo,Linguística; Transfeminismos; Feminismos; Análise do discurso,"Este trabalho tem como objetivo analisar discursos feministas que tematizam os sujeitos transgêneros e/ou travestis e/ou transexuais. Tratam-se sobretudo de análises de discursos feministas radicais trans-excludentes e/ou autointitulados ""críticos de gênero"" através de um referencial teórico transfeminista, ao qual a autora deste trabalho explicitamente se filia. Concentramos nossas análises nas teorizações de duas autoras acadêmicas: Janice G. Raymond e Sheila Jeffreys. As teorizações destas duas autoras possuem uma vasta influência nos posicionamentos trans-excludentes nos discursos e movimentos feministas contemporâneos. Para tanto, iremos utilizar conceitos provenientes do campo teórico da Análise de Discurso, tal como o de formação discursiva, visando compreender a textualização da problemática teórica feminista. Nosso corpus de análise conta com textos provenientes de livros, revistas acadêmicas (artigos e resenhas de livros), portais de notícias, sites e blogs (todos de acesso público). Abordamos os temas centrais de polêmicas entre transfeministas e feministas radicais: alterações corporais pela medicina; socialização; estereótipos, identidade e abolição de gênero; a negação da autenticidade das identidades trans e a sexualidade lésbica. Levamos em consideração a íntima relação entre as construções linguísticas e ideológicas para a análise de discursos feministas. Nomeamos duas tendências no discurso feminista radical trans-excludente: paternalista e conspiratória. Nos detivemos sobretudo para os efeitos produzidos pelas construções linguísticas de negação que incidem sobre as formulações que tematizam a questão da subversão e identidade de gênero. Em virtude da importância e centralidade do efeito de denegação nos discursos analisados, trazemos as considerações teóricas da linguística e psicanálise sobre a negação. Além da negação, trazemos a discussão sobre pressuposição linguística e sua relação com o conceito de pré-construído, além da questão do reconhecimento, vulnerabilidade, subjetividade e a relação entre feminismo e psicanálise. Pudemos concluir que em virtude do reconhecimento das identidades transgêneras ser enquadrado no âmbito individual e intencional e a problemática da subversão de gênero ser textualizada pelo efeito de denegação, não houve uma mudança de terreno epistemológico de uma problemática idealista pela formação teórica feminista radical trans-excludente",,,Teses e Dissertações,Dissertação (Mestrado),,,UNICAMP,,Brazil,-22.8182415,-47.0646455
Iazzetti_DT_Existe.pdf,,,iazzetti_dt_existe,application/pdf,pdf,/objects/thumbs/iazzetti_dt_existe_th.jpg,,2021,Brume Dezembro Iazzetti,Existe 'universidade' em pajubá?: Transições e interseccionalidades no acesso e permanência de pessoas trans*,Educação; Antropologia; Movimentos Sociais; Cotas trans; Interseccionalidade,"A última década foi marcada por passagens importantes no acesso de pessoas trans* no ensino superior. Embora tais ações se revistam de fragilidades, além de manter estreita interdependência com medidas de promoção de permanência, delimitam um cenário novo: as primeiras pessoas trans* que utilizaram o nome social nos exames para ingresso no ensino superior começam a finalizar seus cursos, algumas delas seguem carreira acadêmica e diversos programas de graduação e pós-graduação estendem suas ações afirmativas para pessoas trans*. A pesquisa busca se atentar às questões de acesso e permanência de estudantes trans* no ensino superior público brasileiro, observando, sob uma perspectiva interseccional, dinâmicas políticas, epistemológicas e afetivas nas transições de tais corpos e histórias entre redes estatais, acadêmicas e ativistas. Desse modo, procura atentar-se a) ao mapeamento e historicidade desses percursos legais e seus meandros práticos, considerando suas nuances e dobras; b) às estratégias de agenciamentos individuais e coletivos, tanto na universidade em sua multiplicidade interna quanto em sua inserção em redes mais amplas, tendo em vista seus limites e desafios e c) às categorias e debates mobilizados nos relatos de estudantes trans* no cotidiano nesse (e além desse) espaço. Para tanto, esta etnografia pretende articular análise documental e quantitativa, entrevistas com estudantes de graduação e pós-graduação e observação em eventos organizados por/para pessoas trans*",,,Teses e Dissertações,Dissertação (Mestrado),,,UNICAMP,,Brazil,-22.8182415,-47.0646455
Pinheiro_DT_Linnda.pdf,,,pinheiro_dt_linnda,application/pdf,pdf,/objects/thumbs/pinheiro_dt_linnda_th.jpg,,2022,Rafa Pinheiro,"Linn(da) que brada: Dissidências poéticas, corporalidade em movimento e estéticas insurgentes",Ciências Sociais; Artes; Corpo,"A produção acadêmica voltada para questões de gênero e sexualidade alcança diferentes áreas e abordagens transdisciplinares, assim como uma pluralidade de linguagens artísticas contemporâneas amplifica tais questões por meio de interpelações e desconstruções corporais, identitárias e sexuais. Partindo de um cenário de emergência de artistas de gênero e sexualidade dissidentes no Brasil, esta dissertação focaliza a sua análise nas produções da artista multimídia Linn da Quebrada. Radicada em São Paulo, ela transitou entre a dança, o teatro, a performance artística, o audiovisual, e, desde 2016, realiza imersões musicais em apresentações com grande repercussão nacional e internacional. A pesquisa é orientada por três questões mobilizadas pela própria artista em entrevista: “o que pode este corpo?”, “o que só este corpo carrega?” e “qual a força de uma canção?”. O exercício analítico acompanha a fluidez das autodenominações que a artista propõe, a implicação mútua entre corpo e obra de arte, a aproximação das performances artísticas nos shows com a performatividade de gênero, assim como as intersecções entre as letras musicais do seu primeiro álbum de estúdio, intitulado Pajubá (2017), e os debates acadêmicos de gênero e sexualidade. O percurso metodológico inclui observações livres de situações e cenas presenciadas em shows, registros textuais e fotográficos das apresentações, utilização de notas biográficas e reflexões concedidas pela artista durante algumas entrevistas, trechos disponíveis no documentário longa-metragem Bixa Travesty (2018), descrições densas de eventos on-line em que a artista participou durante o período da pandemia de Covid-19, bem como as impressões de seu retorno ao palco após a alta visibilidade conquistada através da participação no reality show Big Brother Brasil.",,,Teses e Dissertações,Dissertação (Mestrado),,,UNIFESP,,Brazil,-23.5595478,-46.64830767
Caetano_DT_Estudos.pdf,,,caetano_dt_estudos,application/pdf,pdf,/objects/thumbs/caetano_dt_estudos_th.jpg,,2024,Morgan Franzoni Caetano,Estudos Não-Bináries: mapeamento de uma década de publicações sobre não-binariedade de gênero no Brasil,Não-binaridades; Mapeamento; Antropologia; CIências Sociais,"Este trabalho compõe o crescente campo de estudos sobre não-binariedade de gênero no Brasil. Seu objetivo é mapear produções e publicações nacionais sobre o tema, em especial no meio acadêmico, compreendendo como a não-binariedade tem adentrado o âmbito da pesquisa no ensino superior. Para tal, foi realizada uma pesquisa documental através de diversas plataformas de busca como currículo Lattes, Google Acadêmico e Scielo, que resultou em 105 textos identificados sobre o tema, no período entre 2015 e março de 2024. Foram levantadas pesquisas em andamento e eventos que ocorreram ao longo do período mapeado, de modo a relacionar o aumento crescente do número de publicações com o contexto sociopolítico geral do país, considerando recentes políticas de ações afirmativas em instituições de ensino superior para pessoas trans, assim como disputas internas à comunidade LGBTIAP+ que extrapolam os limites dos textos, porém que contribuem para desenhar os sentidos da categoria não-binárie. Assim, entende-se que o aumento perceptível das produções sobre não-binariedade de gênero contribui para a elaboração e estabelecimento dessa categoria emergente, não apenas pelo que dissertam sobre o tema, mas considerando as condições e locais nos quais são desenvolvidos",,,Teses e Dissertações,Dissertação (Mestrado),,,USP,,Brazil,-23.56092993,-46.73093151
