filename,objectid,format,title,date,Author(s),Title (EN) (DeepSeek),Title (EN) (Copilot),Título (ES) (Deepseek),Titulo (ES) (Copilot),Co-author 1,Co-author 2,Type,Sub-Type,Publisher,Journal,University (PT),University (Acronym),Área (PT),Area (EN),Area (ES),Resumo (PT),Abstract (EN),Resumen (ES),Palavras-chave (PT),Keywords (EN),Palavras-clabe (ES),Link,,
Almeida_A_Homens.pdf,almeida12,application/pdf,"""Homens trans"": novos matizes na aquarela das masculinidades?",2012,Guilherme Almeida,Trans Men: New Shades in the Watercolor of Masculinities?,“Trans Men”: New Shades in the Watercolor of Masculinities?,Hombres trans: ¿nuevos matices en la acuarela de las masculinidades?,“Hombres trans”: ¿nuevos matices en la acuarela de las masculinidades?,,,Paper,Journal Article,,Estudos Feministas,,,,,,"O artigo discute de forma exploratória a emergência de uma nova categoria identitária no Brasil, a de 'homem trans'. Essa se constrói diferenciando-se da identidade lésbica e, também, de expressões de gênero de outros grupos que tiveram seus corpos assignados como femininos ao nascimento, mas que contestam essa assignação sem, contudo, se afirmarem 'homens' de forma constante. Afirma-se que a emergência dos 'homens trans' tem sido potencializada pelo estabelecimento do processo transexualizador no SUS. Discutem-se o uso do termo ""homem trans"" e algumas características comuns a tais sujeitos. Problematizam-se a complexidade de seus processos de autorreconhecimento e construção de masculinidades, sua rápida capacidade de indiferenciação a partir de modificações corporais e, alguns dos efeitos políticos e subjetivos, da visibilidade e da indiferenciação.","The article discusses in an exploratory form the emergence of a new identity category in Brazil, namely ""transmen"". This identity is constructed as a differentiation from the lesbian identity and also from gender expressions of other groups that had their bodies assigned as female upon birth, but that later refuted this assignment without, however, affirming themselves as ""men"" on a permanent way. The article claims that the emergence of ""transmen"" has been made possible by the establishment of the transexualization process in the Public Health Care System. Furthermore, the article discusses the use of the term ""transman"" and some common characteristics related to those persons. The author critiques their complex processes of self-knowledge and construction of masculinities, as well as their quick capacity for non-differentiation from the stand-point of bodily modifications. Finally, the author discusses the political and subjective consequences of their visibility and non-differentiation.",,transexualidade; homens transexuais; reconhecimento; gênero,Transsexuality; Transsexual Men; Recognition; Gender,,Link,,
Andrade_DT_Travestis.pdf,andrade12,application/pdf,Travestis na escola: assujeitamento e resistência à ordem normativa,2012,Luma Nogueira de Andrade,Transvestites in School: Subjection and Resistance to the Normative Order,Travestis in School: Subjugation and Resistance to Normative Order,Travestis en la escuela: sujeción y resistencia al orden normativo,Travestis en la escuela: sujeción y resistencia al orden normativo,,,Dissertation/Thesis,PhD Thesis,,,Universidade Federal do Ceará,UFC,Educação,Education,Educación,"Esta pesquisa tem por objetivo desvendar as resistências e assujeitamentosdas jovens travestis na escola. Evidencia-se o uso de táticas que as jovens/estudantes/travestis fazem para burlar a disciplina e o controle eproduzir linhas de fuga para o acesso e a permanênciano espaço escolar. Como as estudantes travestis se movem na ordem normativa da escola? Como constroem sua experiência de ser jovem travesti na escola? Quais as possibilidades de resistência diante desse ciclo de interdição e práticas reguladoras do sexo existentes na instituição escolar? Para realizara investigação, fez-se um levantamento do número de travestis matriculadas em escolas de Ensino Médio da rede estadual de ensino do Ceará, que orientou a escolha de três escolas para aplicação de questionários com alunos(as), professores(as) e gestores(as). Estabeleço um diálogo com autores como Vale (2005), Benedett (2005), Silva (2007), Kulick (2008), Pelúcio (2009), Certeau (1994) e Foucault (1987).Para o aprofundamento dos dados, desenvolvemos uma pesquisa de caráter etnográfico com as travestis. O resultado da pesquisa apontou que dos 184 municípios do estado do Ceará apenas 25 possuem jovens transgêneros matriculados em escolas estaduais.A negação das travestis no espaço da sala de aula resulta no confinamento e na exclusão, que as transformam em desviantes e indesejadas. Quando isso ocorre no ambiente escolar, a pressão normalmente é tão intensa que impele as travestis a abandonar os estudos, sendo disseminada a ideia de que foi sua própria escolha. Esta justificativa tenta mascarar o fracasso da escola em lidar com as diferenças, camuflando o processo de evasão involuntária induzido pela escola. As travestis pesquisadas se assujeitam e resistem para poder sobreviver; em alguns momentos, elas sucumbiram “ao peso de forças adversas”, mas também conseguiram gozar “as alegrias da solidariedade”.","This research aims to unravel the resistance and submitting of young transvestite in high
school. It shows the use of tactics that young/students/transvestites do to circumvent the
discipline and control and produce drain lines for the access and permanence in school space.
How do transvestite‘s students move in the normative order at school? How do they
build their experience of being a young transvestite in school? What are the
possibilities of resistance in the face of this cycle of interdiction and regulatory practices of
sex existed in the school institution? To realize the investigation, we have made a survey of
the number of transvestites enrolled in state high schools of Ceará, which guided the choice of
three schools for the application of questionnaires with students, teachers and managers. For
further development of the data, we developed a research of ethnographic character with the
transvestites. The result of the research pointed out that of the 184 municipalities of the state
of Ceará only 25 have transgender youth enrolled in state schools. The denial of transvestites
in classroom space results in confinement and exclusion, which turn them into deviant and
undesirable. When this occurs in the school environment, the pressure is so intense that
normally pushes the transvestites to abandon the studies, spreading the idea that it was his/her
own choice. This justification tries to mask the failure of the school in deal with differences,
camouflaging the unintentional evasion process induced by the school. The transvestite
researched submitted and resisted themselves in order to survive; in some moments, they
succumbed “to the weight of adverse forces”, but also managed to enjoy “the joys of
solidarity.”
","El objetivo de esta investigación fue desvelar las resistencias y asujetamientos de las jóvenes travestis en la escuela. En este trabajo, están evidenciados el uso de tácticas usadas por dichas jóvenes/estudiantes/travestis para escaparse del control y de la disciplina del ambiente escolar y también la producción de líneas de fuga para su acceso y permanencia en el mismo. Como las Estudiantes travestis se manejan con el orden normativo de la escuela? Cuáles son las posibilidades de resistencia frente a este ciclo de prohibición y a prácticas reguladoras del sexo presentes en la institución escolar? Para la producción de este trabajo, ha sido hecho un levantamiento del número de travestis anotadas en el bachillerato de la cadena de escuelas pertenecientes al Gobierno Estadual de Ceará, el que nos sugirió la elección de tres escuelas determinadas para la realización de encuestas con alumnos(as), profesores(as) y directores(as). Para el aprofundamiento de los datos, hemos realizado con las travestis una investigación de carácter etnográfico. El resultado de la etnografía apunta que, de todos los184 municipios del estado de Ceará, nomás que 25 tienen jóvenes transgénero anotadas en escuelas estaduales. La negación a las travestis en el ambiente del aula les resulta el confinamiento y la exclusión, haciéndolas desviantes e indeseadas. Al ocurrir tal hecho, la presión es, en general, tan intensa que impele a las mismas a abandonar sus estudios, diseminándose la idea de que esta renuncia es su propia elección. Tal justificativa enmascara el fracaso de la escuela de administrar las diferencias de sus alumnos, escondiendo el proceso de evasión involuntaria de las travestis, inducido por la propia institución. Las travestis encuestadas se asujetan y resisten para sobrevivir en el ambiente escolar; hubo veces en las que tuvieron que ceder ante el ""peso de fuerzas adversas"", pero también han conseguido gozar ""las alegrías de la solidaridad"".","Travesti, Resistência, Assujeitamento, Escola","Transvestite, Resistance, Submitting, School","Travesti, Resistencia, Asujetamiento, Escuela",Link,,
Araujo_DT_Fecundacoes.pdf,araujo19,application/pdf,Fecundações cruzadas: gêneros ameríndios e incursões antropológicas,2019,Bru Pereira de Araujo,Cross-Fertilizations: Amerindian Genders and Anthropological Incursions,Cross-Fertilizations: Amerindian Genders and Anthropological Incursions,Fecundaciones cruzadas: géneros amerindios e incursiones antropológicas,Fecundaciones cruzadas: géneros amerindios e incursiones antropológicas,,,Dissertation/Thesis,Master's Thesis,,,Universidade Federal Paulista,UNESP,Ciências Sociais,Social Sciences,Ciencias Sociales,,,,,,,Link,,
Bagagli_DT_Discursos.pdf,bagagli19,application/pdf,Discursos de transfemininas e feministas radicais: disputas pela significação da mulher no feminismo,2019,Beatriz Bagagli,"Discourses of Transfeminine and Radical Feminists: Struggles Over the Meaning of ""Woman"" in Feminism",Discourses of Transfeminine and Radical Feminists: Disputes Over the Meaning of Woman in Feminism,Discursos de transfemeninas y feministas radicales: disputas por la significación de la mujer en el feminismo,Discursos de transfemeninas y feministas radicales: disputas por la significación de la mujer en el feminismo,,,Dissertation/Thesis,Master's Thesis,,,Universidade Estadual de Campinas,UNICAMP,Linguística,Linguistics,Lingüística,,,,,,,Link,,
Camargo_DT_Pessoas.pdf,camargo20,application/pdf,Pessoas trans nos esportes: os jogos da cisnormatividade,2020,Eric Seger de Camargo,Trans People in Sports: The Games of Cisnormativity,Trans People in Sports: The Games of Cisnormativity,Personas trans en los deportes: los juegos de la cisnormatividad,Personas trans en los deportes: los juegos de la cisnormatividad,,,Dissertation/Thesis,Master's Thesis,,,Universidade Federal do Rio Grande do Sul,UFRGS,Educação,Education,Educación,,,,,,,Link,,
Costa_A_Saidas.pdf,costa20,application/pdf,Saídas de Emergência: autobiografias e espiritualidades trans,2020,Caio Jade Puosso C. Gouveia Costa,Emergency Exits: Trans Autobiographies and Spiritualities,Emergency Exits: Trans Autobiographies and Spiritualities,Salidas de emergencia: autobiografías y espiritualidades trans,Salidas de emergencia: autobiografías y espiritualidades trans,,,Paper,Journal Article,,Sacrilegens,,,,,,,,,,,,Link,,
Costa_DT_Identidade.pdf,costa2020,application/pdf,Identidade racial e transexual: um olhar sobre os PNLD de sociologia,2020,Hainra Asabi Alves Costa,Racial and Transsexual Identity: A Look at Sociology Textbooks (PNLD),Racial and Transsexual Identity: A Look at Sociology Textbooks in the PNLD,Identidad racial y transexual: una mirada sobre los PNLD de sociología,Identidad racial y transexual: una mirada sobre los libros de texto de sociología del PNLD,,,Dissertation/Thesis,Master's Thesis,,,Universidade Estadual Paulista,UNESP,Sociologia,Sociology,Sociología,,,,,,,Link,,
Favero_A_Etica.pdf,favero20,application/pdf,Por uma ética pajubariana: a potência epistemológica das travestis intelectuais,2020,Sofia Favero,Toward a Pajubarian Ethics: The Epistemological Power of Travesti Intellectuals,For a Pajubarian Ethics: The Epistemological Power of Intellectual Travestis,Por una ética pajubariana: la potencia epistemológica de las travestis intelectuales,Por una ética pajubariana: el poder epistemológico de las travestis intelectuales,,,Paper,Journal Article,,Equatorial,,,,,,,,,,,,Link,,
Grunvald_DT_Existencias.pdf,grunvald16,application/pdf,"Existências, insistências e travessias: sobre algumas poéticas e políticas do travestimento",2016,Vi Grunvald,"Existences, Insistences, and Crossings: On Some Poetics and Politics of Transvestism","Existences, Insistences, and Crossings: On Some Poetics and Politics of Travestism","Existencias, insistencias y travesías: sobre algunas poéticas y políticas del travestismo","Existencias, insistencias y travesías: sobre algunas poéticas y políticas del travestismo",,,Dissertation/Thesis,PhD Thesis,,,Universidade de São Paulo,USP,Antropologia Social,Social Anthropology,Antropología Social,,,,,,,Link,,
Jesus_A_Feminismos.pdf,jesus18,application/pdf,Feminismos contemporâneos e interseccionalidades,2018,Jaqueline Gomes de Jesus,Contemporary Feminisms and Intersectionalities,Contemporary Feminisms and Intersectionalities,Feminismos contemporáneos e interseccionalidades,Feminismos contemporáneos e interseccionalidades,,,Paper,Journal Article,,REBEH,,,,,,,,,,,,Link,,new edition n-1
Jesus_DT_Protesto.pdf,jesus10,application/pdf,O protesto na festa: política e carnavalização nas paradas do orgulho LGBT,2010,Jaqueline Gomes de Jesus,Protest at the Party: Politics and Carnivalization in LGBT Pride Parades,Protest in Celebration: Politics and Carnivalization in LGBT Pride Parades,La protesta en la fiesta: política y carnavalización en los desfiles del orgullo LGBT,La protesta en la fiesta: política y carnavalización en las marchas del orgullo LGBT,,,Dissertation/Thesis,PhD Thesis,,,Universidade de Brasília,UnB,Psicologia Social,Social Psychology,Psicología Social,"Paradas do Orgulho de Lésbicas, Gays, Bissexuais e Travestis e Transexuais (LGBT) são eventos de ordem política para a população LGBT, articulações sociais representativas da racionalidade das manifestações de massa, conforme apregoado por Surowiecki (2004). Iniciadas nos Estados Unidos durante os anos 70, enquanto marchas políticas de denúncia da violência, da criminalização e da patologização das pessoas LGBT, foram absorvidas e adaptadas à cultura brasileira, desvinculando-se das tradições de seu surgimento. São organizadas por grupos de defesa dos direitos humanos de LGBT, que se inscrevem no modelo que Gohn (1991) define como o dos novos movimentos sociais. Visto que a ação das paradas indica uma relação dinâmica e conflituosa entre os grupos excluídos e a sociedade que os oprime, sugere-se que vem ao encontro do que é defendido por Moscovici (1981) no que tange às minorias ativas. A presente Tese objetivou investigar a compreensão dos participantes das Paradas do orgulho LGBT acerca da natureza e do grau de sua participação política nesse evento, analisando evocações e discursos de participantes de Paradas do Orgulho LGBT acerca da Parada e sua constituição política e festiva. O estudo foi dividido em três estudos, com um número total de participantes 214 (duzentas e quatorze) pessoas. No primeiro estudo, cujo objetivo era identificar as percepções gerais de participantes de Paradas acerca desse evento, a fim de contribuir com subsídios para uma pesquisa mais aprofundada, foram analisadas as evocações feitas pelos participantes de Paradas das cidades de Brasília e de Goiânia, no ano de 2007, acerca do tema ―Parada‖, utilizando um instrumento de evocação, cujos resultados foram analisados por meio do software Evoc (Vergès, 2000). O segundo estudo, realizado em Brasília, no ano de 2008, investigou percepções de mulheres participantes e organizadoras de paradas, tendo como referência teórico-empírica as questões de gênero, tendo como objetivo entender as particularidades das mulheres que organizam ou que apenas participam desses eventos, e fazendo uso de entrevistas semi-estruturadas que foram analisadas de acordo com análise do discurso orientada pela leitura crítica proposta por Gill (2003), a qual articula a fala do sujeito com o contexto vivido, e não com questões universais. O terceiro estudo, cujo objetivo era aprofundar os temas encontrados no primeiro e no segundo estudo, foi pautado por entrevistas semi-estruturadas, realizadas durante a Parada do Orgulho LGBT de São Paulo, de 2009, as quais foram analisadas por meio do software Alceste (Reinert, 1990, citado em Oliveira e cols., 2003; Reinert, 1983, 1990, 1993 e 1998, citado em Kronberger e Wagner, 2003). A parte empírica da Tese, que detalha a metodologia, explica mais aprofundadamente as razões para que cada estudo tenha sido feito em uma cidade diferente, dentre elas o fato de a coleta de dados ter ocorrido durante as Paradas, quando era possível entrevistar um número significativo de participantes. Por essa razão, ocorreram em datas diferentes, aproveitando-se a realização das paradas que ocorriam em diferentes datas nos diferentes lugares. Concluiu-se que as percepções de participantes e de organizadores das Paradas do Orgulho LGBT não necessariamente concordam, porém se identifica coesão entre os respondentes no que se refere à compreensão da Parada como um ato político e, ao mesmo tempo, festivo, além da noção de que a possibilidade de demonstrarem nesses eventos quem são e como preferem viver é, em si, um ato de manifestação política para além dos mecanismos tradicionais de participação política. Um protesto festivo","Lesbians, Gays, Bissexuals, Travestites and Transsexuals (LGBT) pride parades are events of political
order to LGBT population, social articulations representative of the rationality of the mass
manifestations, as defended by Surowiecki (2004). Begun at the United States during the
seventies, as political marchs of denounce of the violence, of the criminalization and of the
pathologization of the LGBT people, they were absorbed and adapted to the Brazilian culture,
getting farther from the traditions of its arouse. They are organized by groups of defense of
the LGBT human rights, which are inscribed at the model that Gohn (1991) defines as that of
the new social movements. Seen that the action of the parades indicates a dynamic and
conflictuous relation between the excluded groups and the oppressing society, it is suggested
that it comes in accord to what is defended by Moscovici (1981) in what attains to the active
minorities. The present Thesis aimed to investigate the comprehension of the participants of
the LGBT Pride Parades about the nature and the level of their political participation in that
event, analyzing evocations and discourses of the participants of the LGBT Pride Parades on
the Parade and its political and carnivalized constitution. The study was divided into three
researchs, with a total number of 214 (two hundred and fourteen) people. In the first research,
which aim was to identify the general perceptions of the participants of the Parades on this
event, in order to contribute with resources to a deeper research, were analysed the evocations
given by the participants of the Parades of the cities of Brasília and Goiânia, in the year 2007,
about the theme ―Parade‖, by means of a instrument of evocation whose results were analyzed
through the software Evoc (Vergès, 2000). The second research, realized at Brasília, in the
year 2008, investigated perceptions of women participants and organizers of Parades, having
as theorical-empirical reference gender matters, having as objective understand the
particularities of the women who organize or just participate of these events, and using halfstructured interviews that were analyzed according to discourse analysis oriented by critical
lecture proposed by Gill (2003), that articulates the speech of the subject with the living
context, not with universal questions. The third research, whose objective was to deepen the
themes found in the first and in the second research, was guided by half-structured interviews,
realized during the LGBT Pride Parade of Sao Paulo, of 2009, which were analyzed through
the software Alceste (Reinert, 1990, cited in Oliveira and cols., 2003; Reinert, 1983, 1990,
1993 and 1998, cited in Kronberger and Wagner, 2003). The empirical part of the Thesis, that
details the methodology, explain more deeply the reasons for each study having being done at
a different city, among them the fact of the data collection having occurred during the
Parades, when it was possible to interview a significant number of participants. For that
reason, occurred in different dates, getting use of the realization of the parades that occurred
in different data in the different places. It was concluded that the perceptions of the
participants and of the organizers of the LGBT Pride Parades not necessarily agree, although
it is identified cohesion between the respondents in what refers to the comprehension of the
Parade as a political act and, at the same time, a festive one beyond the notion that the
possibility of them to demonstrate in these events who they are and how they would rather to
live is, in itself, an act of political manifestation beyond the traditional mechanisms of
political participation. A festive protest.",,"Paradas do Orgulho LGBT, Movimentos Sociais, Identidade de Gênero,
Percepções, Carnavalização","LGBT Pride Parades, Social Movements, Gender Identity, Perceptions, Carnivalization",,Link,,
Lima_DT_Transitos.pdf,lima22,application/pdf,Trânsitos em texto: uma análise comparada de biografias e autobiografias de pessoas trans no Brasil e nos EUA,2022,Lux Ferreira de Lima,Transits in Text: A Comparative Analysis of Trans Biographies and Autobiographies in Brazil and the U.S.,Transits in Text: A Comparative Analysis of Trans Biographies and Autobiographies in Brazil and the U.S.,Tránsitos en texto: un análisis comparado de biografías y autobiografías de personas trans en Brasil y EE.UU.,Tránsitos en texto: un análisis comparado de biografías y autobiografías de personas trans en Brasil y EE.UU.,,,Dissertation/Thesis,PhD Thesis,,,Universidade de São Paulo,USP,Antropologia Social,Social Anthropology,Antropología Social,,,,,,,Link,,
Neves_DT_Hospitalidade.pdf,neves15,application/pdf,Transmasculinidades e o cuidado em saúde: desafios e impasses por vidas não fascistas,2015,Benjamin Neves,Transmasculinities and Healthcare: Challenges and Impasses for Non-Fascist Lives,Transmasculinities and Healthcare: Challenges and Dilemmas for Anti-Fascist Lives,Transmasculinidades y el cuidado en salud: desafíos e impases por vidas no fascistas,Transmasculinidades y el cuidado en salud: desafíos e impasses por vidas no fascistas,,,Dissertation/Thesis,Master's Thesis,,,Universidade Federal do Rio de Janeiro,UFRJ,Clínica Médica,Medical Clinic,Clínica Médica,,,,,,,Link,,
Oliveira_DT_Somos.pdf,oliveira15,application/pdf,Somos quem podemos ser: os homens (trans) brasileiros e o discurso pela (des)patologização da transexualidade,2015,André Lucas Guerreiro Oliveira,We Are Who We Can Be: Brazilian (Trans) Men and the Discourse on the (De)Pathologization of Transsexuality,We Are Who We Can Be: Brazilian (Trans) Men and the Discourse for the (De)Pathologization of Transsexuality,Somos quienes podemos ser: los hombres (trans) brasileños y el discurso por la (des)patologización de la transexualidad,Somos quienes podemos ser: los hombres (trans) brasileños y el discurso por la (des)patologización de la transexualidad,,,Dissertation/Thesis,Master's Thesis,,,Universidade Federal do Rio Grande do Norte,UFRN,Ciências Sociais,Social Sciences,Ciencias Sociales,,,,,,,Link,,
Paiva_DT_Travas.pdf,paiva20,application/pdf,“As travas de Jardim são unidas”: etnografia da performance identitária das travestis em contextos rurais,2020,Pietra Azevedo Paiva,The Travestis of Jardim Are United: Ethnography of Travesti Identity Performance in Rural Contexts,“The Travas of Jardim Are United”: Ethnography of Travesti Identity Performance in Rural Contexts,Las travas de Jardim son unidas: etnografía de la performance identitaria de las travestis en contextos rurales,“Las travas de Jardim están unidas”: etnografía de la performance identitaria de las travestis en contextos rurales,,,Dissertation/Thesis,Master's Thesis,,,Universidade Federal do Rio Grande do Norte,UFRN,Antropologia,Anthropology,Antropología,,,,,,,Link,,
Pinheiro_DT_Linnda.pdf,pinheiro22,application/pdf,"Linn(da) que brada: Dissidências poéticas, corporalidade em movimento e estéticas insurgentes",2022,Rafa Pinheiro,,"Linn(da) Who Roars: Poetic Dissidences, Moving Corporality, and Insurgent Aesthetics","Linn(da) que grita: Disidencias poéticas, corporalidad en movimiento y estéticas insurgentes","Linn(da) que clama: disidencias poéticas, corporalidad en movimiento y estéticas insurgentes",,,Dissertation/Thesis,Master's Thesis,,,Universidade Federal de São Paulo,UNIFESP,Ciências Sociais,Social Sciences,Ciencias Sociales,,,,,,,Link,,
