filename,external,worldcat,objectid,format,display_template,image_thumb,image_small,date,creator,title,subject,abstract,synopsis,description,classification,genre,publisher,journal,university,address,country,latitude,longitude
Lustosa_A_Nao.pdf,,,Lustosa_A_Nao,application/pdf,pdf,/objects/thumbs/Lustosa_A_Nao_th.jpg,,2016,Tertuliana Lustosa,Manifesto Traveco-Terrorista,Travestilidades; Manifesto,,,,Artigo em Periódico,Artigo em Periódico,,concinnitas,UERJ,,Brazil,-22.91099594,-43.23608941
Jesus_A_Xica.pdf,,,jesus_a_xica,application/pdf,pdf,/objects/thumbs/jesus_a_xica_th.jpg,,2019,Jaqueline Gomes de Jesus,Xica Manicongo: a transgeneridade toma a palavra,História; Transfeminismos; Identidade; Movimentos sociais,"O  presente  artigo  apresenta  a  estória  de  Xica  Manicongo,   natural  do   Congo  e  escravizada, registrada oficialmente como Francisco, conhecida atualmente como a primeira travesti da História do Brasil, considerando os  registros  de  sua  existência,  derivados  os arquivos  da  Primeira  Visitação  da  Inquisição.  Delineando  uma trajetória histórica dos usos das informações disponíveis desde o século XVI,  por  parte  de  pesquisadores,  movimentos  sociais  e  artísticos, reitera-se  o  caráter  mobilizacional  da construção  de  memória  coletiva,  e  seu  papel relevantena  construção  e  protagonização  de  identidades  grupais, particularmente,  daquelas  identificadas  no  âmbito  das  identidades  de  gênero  trans,  tendo  em  vista  sua apropriação simbólica e ressignificação na contemporaneidade.",,,Artigo em Periódico,Artigo em Periódico,,ReDoc,UERJ,,Brazil,-22.91099594,-43.23608941
Carvalho_A_Corpo.pdf,,,carvalho_a_corpo,application/pdf,pdf,/objects/thumbs/carvalho_a_corpo_th.jpg,,2019,Renata Carvalho,"O Corpo Transvestigênere, O Corpo Travesti na Arte",Artes; Dramaturgia,"Quando  o  editor  da  RE-DOC  falou  da  possibilidade  de  estarmos  juntes/xs/as/osenquanto  trans-academicas juntoa/os artivistas, em uma secção artística a primeira pessoa que nos veio à mente, foi a artista, Renata Carvalho*. O motivo foi seu papel nos últimos anos encarnando Jesus Cristo, na peça “O  evangelho  segundo  Jesus,  rainha  do  céu”,  protagonizado  pela  atriz  e  mulher  trans/travesti Renata**, em um texto da britânica e também  mulher transgênero, Jo  Clifford, e que foi traduzido e dirigido  por  Natalia  Mallo.  A  peça  é  um  monólogo  e  traz  histórias  bíblicas  sob  a  perspectiva contemporânea  e  sob  a  versão  transgênera.    A  artista  Renata  Carvalho  e  sua  equipe  tiveram  seu trabalho cancelado por várias vezes em função de ataques contínuos por parte de alguns membros de grupos  religiosos,  entre  eles,  aqueles  ligados  à  Igreja  Católica.  Para  que  parte  do  texto  de  seu  novo espetáculo  estivesse  presente  neste  dossiê,  esperamos  por  seu  retorno  ao  Brasil,  depois  da  turnê  em apresentações pelo Reino Unido, Europa Central e África.  O texto abaixo é o retorno ao nosso pedido por uma composição artística, autoral e inédita para esta revista e segue na integra com a fotografia da autora,  produtora  e  atriz,  como  parte  daquilo  que  é  apresentado  em  seu  trabalho  mais  recente,  o “Manisfeto Transpofágico”",,,Artigo em Periódico,Artigo em Periódico,,ReDoC,UERJ,,Brazil,-22.91099594,-43.23608941
Pontes_A_Criancas.pdf,,,pontes_a_criancas,application/pdf,pdf,/objects/thumbs/pontes_a_criancas_th.jpg,,2020,Júlia Pontes; Cristiane Gonçalves Silva; Eunice Nakamura,Crianças e adolescentes trans. A construção de categorias entre profissionais de saúde,Crianças trans; Saúde; Saúde Coletiva; Cuidado; Co-autoria,"Este artigo tem por objetivo descrever e discutir os significados e concepções atribuídos por um grupo de profissionais de saúde às categorias “crianças” e “adolescentes” trans e sua relação com as práticas de cuidado por eles realizadas, privilegiando uma abordagem sociocultural sobre o cuidado. Baseia-se em uma pesquisa de abordagem etnográfica que incluiu a realização de entrevistas em profundidade com profissionais de saúde que atuam ou já atuaram em serviços especializados no atendimento de crianças e adolescentes trans e seus familiares, localizados no Estado de São Paulo. Os resultados apontam como as definições dos profissionais sobrepõem critérios biomédicos e concepções socioculturais de gênero, revelando impasses e controvérsias implicadas na avaliação diagnóstica da identidade de gênero de crianças e adolescentes em termos de fixidez e permanência.",,,Artigo em Periódico,Artigo em Periódico,,"Sexualidad, Salud y Sociedad",UERJ,,Brazil,-22.91099594,-43.23608941
Iazzetti_A_Futuros.pdf,,,iazzetti_a_futuros,application/pdf,pdf,/objects/thumbs/iazzetti_a_futuros_th.jpg,,2024,Brume Dezembro Iazzetti,Futuros Trans* Possíveis: Interseccionalidades e ambivalências no acesso e na permanência de pessoas trans* no ensino superior público brasileiro,Antropologia; Educação; Movimentos sociais; Interseccionaolidade; Cotas trans,"A última década foi marcada por passagens importantes no acesso de pessoas trans* ao ensino superior brasileiro, atreladas a uma gama de direitos recentemente conquistados, particularmente o nome social, que regulamenta em instituições públicas o uso do nome com o qual pessoas trans* se identificam, e a implementação de políticas afirmativas em universidades públicas a partir do final dos anos 2010. Partindo da provocação de uma das entrevistadas de que “pensar sobre futuro é privilégio de poucos”, este artigo procura entrelaçar relatos da trajetória de estudantes trans* para versar sobre as ambivalências do acesso e da permanência desses sujeitos na universidade, descrita tanto como um espaço permeado por violências institucionais e processos subjetivos de adoecimento quanto de um espaço que possibilitou uma experimentação de gênero e a construção de redes afetivas e políticas. Para tanto, é fundamental adotarmos uma perspectiva interseccional que compreenda as diferenças e as desigualdades permeadas nesses relatos, possibilitando distintos acessos e permanências no (e além do) espaço da universidade.",,,Artigo em Periódico,Artigo em Periódico,,"Sexualidad, Salud y Sociedad",UERJ,,Brazil,-22.91099594,-43.23608941
Oliveira_A_Trejeitos.pdf,,,oliveira_a_trejeitos,application/pdf,pdf,/objects/thumbs/oliveira_a_trejeitos_th.jpg,,2018,Megg Rayara Gomes de Oliveira,"Trejeitos e trajetos de gayzinhos, afeminados, viadinhos e bichinhas pretas na educação!",Educação; Negritude; Raça,"Neste artigo, extraído da minha tese de doutorado, analiso as experiências de gays afeminados, viados e bichas pretas na escola, procurando identificar os elementos que incidem nos processos de subjetivação das experiências negras que fogem à norma cis heterossexual. Utilizei a metodologia das (auto)biografias proposta pelo pesquisador Marcio Caetano (2016), por estas se constituírem como fragmentos que apresentam a vida com base em diversos pontos de vista dos sujeitos. O conceito de interseccionalidade desenvolvido pela jurista negra estadunidense Kimberlé Crenshaw possibilitou o revezamento entre diversas áreas do conhecimento, como os estudos das relações étnico- raciais, os estudos de gênero e diversidade sexual e os estudos feministas. Sendo assim, este trabalho se caracteriza por uma pesquisa bibliográfica que preparou o terreno para colocar em ação o método (auto)biográfico. Quatro professores em atividade em escolas públicas no Paraná e no Rio de Janeiro, que escapam às práticas da cis heterossexualidade normativa e da branquidade hegemônica, são os personagens desta pesquisa. Através de suas narrativas foi possível pautar o vocábulo “preto/a” como categoria de análise e não como simples adjetivo, bem como as categorias gay afeminado, viado e bicha. Nenhuma categoria aqui debatida foi tratada como algo estático, fixo, cristalizado, numa oposição declarada às visões essencialistas que generalizam existências desconsiderando os múltiplos processos que as envolvem.",,,Artigo em Periódico,Artigo em Periódico,,Periódicus,UFBA,,Brazil,-12.74983165,-38.48214151
Lustosa_A_Lenda.pdf,,,lustosa_a_lenda,application/pdf,pdf,/objects/thumbs/lustosa_a_lenda_th.jpg,,2018,Tertuliana Mascarenhas Lustosa,A lenda da trava leiteira,Travestilidades; Ensaio; Contextos rurais,"Eu propus-me a realizar uma pesquisa para escrever uma lenda, a lenda da trava leiteira, o que me demandou, uma investigação sobre o gênero lenda e a oralidade, e também sobre política e lutas afirmativas no âmbito da sexualidade e do feminismo. Toda essa investigação confrontou arte contemporânea, protesto, pintura, etc.: Lyz Parayzo, Augusto Braz, Delacroix, Indiana Siqueira, Luciana Vasconcellos e Evelym Gutierrez... O corpo da trava leiteira foi uma pesquisa sobre o meu próprio corpo trans e suas modificações e vetores políticos, o que me fez perceber que o mais prudente para compreender a lenda seria entender antes a relação entre cidade e natureza (o universo dos rios) enquanto fonte de imaginação e narrativa popular. Sendo assim, busquei a lenda do Cabeça de Cuia e a lenda da lagoa do Parnaguá.",,,Artigo em Periódico,Artigo em Periódico,,Periódicus,UFBA,,Brazil,-12.74983165,-38.48214151
Lanz_A_Ser.pdf,,,lanz_a_ser,application/pdf,pdf,/objects/thumbs/lanz_a_ser_th.jpg,,2016,Letícia Lanz,Ser uma pessoa transgênera é ser um não-ser,Binarismo,"Ser uma pessoa transgênera é ser um não-ser, alguém que mesmo tendo existência material não é
socialmente reconhecida e legitimada. É o “olhar do outro” – ou seja, o olhar da sociedade – quem atesta o êxito ou o fracasso da pessoa transgênera em passar como membro do gênero oposto. Gênero e orientação social só sobrevivem como critérios de classificação e hierarquização dos seres humanos graças à permanente ratificação – ou contestação – do olhar do outro, que é, em última análise, o olhar de aprovação ou de reprovação da própria sociedade. Somente através do combate sistemático ao binarismo de gênero, às normas de conduta e aos estereótipos dele resultantes será possível assegurar, em longo prazo, a maior visibilidade social para as pessoas transgêneras que, finalmente, poderão manifestar livremente suas singulares expressões de gênero, e orgulhar-se delas, por mais discrepantes que sejam dos modelos oficiais de homem e mulher, instituídos e patrocinados pela ordem social vigente",,,Artigo em Periódico,Artigo em Periódico,,Periódicus,UFBA,,Brazil,-12.74983165,-38.48214151
Dumaresq_A_Ensaio.pdf,,,dumaresq_a_ensaio,application/pdf,pdf,/objects/thumbs/dumaresq_a_ensaio_th.jpg,,2016,Leila Dumaresq,Ensaio (travesti) sobre a escuta (cisgênera),Cisgeneridade,"Neste ensaio apresento o processo de escuta enquanto fenômeno social epistêmico e aprofundo a discussão sobre a importância e a utilidade da categoria 'cisgênero' no empoderamento da travestilidade, assim como as outras identidades de gênero subalternas.",,,Artigo em Periódico,Artigo em Periódico,,Periódicus,UFBA,,Brazil,-12.74983165,-38.48214151
Costa_A_Saidas.pdf,,,costa_a_saidas,application/pdf,pdf,/objects/thumbs/costa_a_saidas_th.jpg,,2020,Caio Jade Puosso Cardoso Gouveia Costa,Saídas de Emergência: autobiografias e espiritualidades trans,Biografia; Transmasculinidades; Travestilidades; História; Espiritualidade,"Este artigo apresentará as diferentes perspectivas religiosas e espirituais encontradas nos textos autobiográficos de Claudia Wonder, Roberta Close, Lorys Ádreon, Ruddy Pinho, Jorge Laffond e Jordhan Lessa. Veremos como suas expressões de sexo/gênero são acolhidas ou rejeitadas pelos sistemas religiosos da sociedade brasileira a partir de seus relatos. Analisaremos como espiritualidades singulares são criadas como respostas às exclusões e formatações impostas pelas religiões. Refletiremos sobre a dessacralização de expressões de sexo/gênero diversas como estratégia de exclusão social. Por fim, anunciaremos as religiosidades e espiritualidades trans como estratégias de reintegração e de ressacralização dos seres em relação à vida.",,,Artigo em Periódico,Artigo em Periódico,,Sacrilegens,UFJF,,Brazil,-21.77303751,-43.36901748
Jesus_A_Feminismos.pdf,,,jesus_a_feminismos,application/pdf,pdf,/objects/thumbs/jesus_a_feminismos_th.jpg,,2018,Jaqueline Gomes de Jesus,Feminismos contemporâneos e interseccionalidades,Transfeminismos; Feminismos; Interseccionalidade,"O processo de globalização, acelerado pelas Novas Tecnologias de Informação e Comunicação, tem perpassado fronteiras culturais e propiciado mudanças nas concepções de gênero: tanto nas relações sociais quanto na própria conceituação acerca do que são homens e mulheres. As diferentes vertentes feministas apresentam um papel central nessa transformação, utilizando-se dos recursos da virtualidade para difundir discursos que pressupõe a interação de opressões e a interseccionalidade de identidades como subsídios para a construção de novas práticas sociais. Enquanto novíssimo pensamento-ação feminista, o Transfeminismo incorpora essas características na sua constituição e difusão, constituindo-se como um exemplo das múltiplas aplicações do Feminismo em termos de teoria e política. O presente artigo visa a compor um panorama sintético de discussões contemporâneas do Feminismo, com base na internet, a partir de revisão bibliográfica e da apresentação das concepções de 6 (seis) lideranças transfeministas brasileiras, coletadas via rede social e dispostas na forma de diálogo.",,,Artigo em Periódico,Artigo em Periódico,,REBEH,UFMT,,Brazil,-15.60965936,-56.06511419
Moraes_A_Colonialidade.pdf,,,moraes_a_colonialidade,application/pdf,pdf,/objects/thumbs/moraes_a_colonialidade_th.jpg,,2023,Wallace de Moraes; Cello Latini Pfeil; Bruno Latini Pfeil,Colonialidade cishetero-endossexo: Uma crítica decolonial à decolonialidade,Cisgeneridade; Decolonialidade; Filosofia; Co-autoria,"O presente artigo tem como objetivo apresentar o conceito de colonialidade cishetero-endossexo, de modo a apontar para a lacuna dos estudos decoloniais em pensar as opressões que pessoas trans, intersexo e não-heterossexuais sofrem. Reconhecemos e exaltamos as importantes discussões decoloniais sobre gênero e sexualidade já realizadas, que trouxeram conceitos fundamentais como o de colonialidade de gênero e o de androcentrismo. A partir deles, tornou-se possível refletir sobre violências de gênero através da lente decolonial, ampliando as bases da luta contra a colonialidade. Todavia, percebemos, nestas discussões, a desconsideração da cisgeneridade, da endossexualidade e de sexualidades não-heterossexuais, de forma conjunta, o que se mostra como um grande obstáculo para a resistência e a luta de corpos não-cisheteroendossexo. O conceito de colonialidade cishetero-endossexo procura, então, evidenciar os atravessamentos coloniais/modernos da cisnormatividade, da heteronormatividade e da endonormatividade.",,,Artigo em Periódico,Artigo em Periódico,,REBEH,UFMT,,Brazil,-15.60965936,-56.06511419
Barbosa_A_Trajetorias.pdf,,,barbosa_a_trajetorias,application/pdf,pdf,/objects/thumbs/barbosa_a_trajetorias_th.jpg,,2023,Inaê Iabel Barbosa,Trajetórias e experiências educacionais de pessoas não-bináries: Reflexões teóricas para a construção de uma agenda de pesquisa,Não-binaridades; Educação; Cisgeneridade,"Considerando os efeitos da cisnormatividade e do binarismo de gênero nos processos de construção identitária, bem como os altos índices de evasão escolar de pessoas trans no ensino básico, o baixo índice de pessoas trans no ensino superior e o papel das instituições educacionais no processo de produção e manutenção das normas de gênero, neste artigo, propõe-se a construção de uma agenda de pesquisa centrada na seguinte questão: que experiências sociais marca(ra)m as trajetórias educacionais de pessoas não-bináries? Na conjugação de debates sobre transidentidades e educação, desenvolve-se um exercício teórico-reflexivo que almeja justificar a importância de estudos sobre as especificidades das identidades não-bináries, com atenção especial às experiências educacionais de tais sujeitos.",,,Artigo em Periódico,Artigo em Periódico,,Zabelê,UFPI,,Brazil,-5.057338805,-42.79786176
Braz_A_Materializacoes.pdf,,,braz_a_materializacoes,application/pdf,pdf,/objects/thumbs/braz_a_materializacoes_th.jpg,,2025,Emília Braz,Materializações cis/trans do corpo através da remoção de pelos corporais,Cisgeneridade; Feminismos; Materialidades; Estudos feministas de ciência,"Os pelos corporais e faciais são relativamente definidos em padrões masculino e feminino através de características como quantidade, distribuição, textura, pigmentação e densidade. A cartografia do dimorfismo sexual a partir dos pelos corporais serve como ponto de partida para investigar (auto)etnograficamente a materialização da cisgeneridade. Analisa-se um conjunto de eventos e situações relacionadas à remoção de pelos corporais que ocorreram entre 2008 e 2018. Com base nos estudos sociais e feministas da ciência, objetiva-se lançar luz às dinâmicas performativas através das quais o corpo se materializa e as diferenças que importam nessa materialização. Apresenta-se a cisgeneridade como um elemento produtivo de fronteiras e substâncias nas experiências corpóreas de pessoas cis e trans, o que chamei de aparato material-discursivo de produção corporal. Conclui-se que a remoção de pelos corporais não é algo natural, mas um fenômeno material-discursivo que produz detalhada e ferrenhamente certas características físicas e padrões de gênero.",,,Artigo em Periódico,Artigo em Periódico,,Horizontes Antropológicos,UFRGS,,Brazil,-30.03367535,-51.21913413
Favero_A_Cisgeneridades.pdf,,,favero_a_cisgeneridades,application/pdf,pdf,/objects/thumbs/favero_a_cisgeneridades_th.jpg,,2019,Sofia Favero,"Cisgeneridades precárias: Raça, gênero e sexualidade na contramão da política do relato",Cisgeneridade; Psicologia; Raça; Relato,,,,Artigo em Periódico,Artigo em Periódico,,Bagoas,UFRN,,Brazil,-5.83942619,-35.20048149
Favero_A_Etica.pdf,,,favero_a_etica,application/pdf,pdf,/objects/thumbs/favero_a_etica_th.jpg,,2020,Sofia Favero,Por uma ética pajubariana: a potência epistemológica das travestis intelectuais,Travestilidades; Epistemologia; Relato; Psicologia,"O presente artigo analisa o deslocamento da posição de “pesquisadas” para a de “pesquisadoras” que tem sido empreendido pelas travestis intelectuais brasileiras. Para discutir essa questão, retoma algumas construções teóricas acerca dos saberes localizados, mas coloca em análise a fragilidade ontológica do conceito de local de fala. Nesse sentido, entende que é necessária a criação de uma ética capaz de conjugar os esquemas linguísticos e cosmológicos das travestis com o cenário científico que se desdobra na atualidade.",,,Artigo em Periódico,Artigo em Periódico,,Equatorial,UFRN,,Brazil,-5.83942619,-35.20048149
Almeida_A_Homens.pdf,,,almeida_a_homens,application/pdf,pdf,/objects/thumbs/almeida_a_homens_th.jpg,,2012,Guilherme Almeida,"""Homens trans"": novos matizes na aquarela das masculinidades?",Transmasculinidades; Saúde; Movimentos Sociais,"O artigo discute de forma exploratória a emergência de uma nova categoria identitária no Brasil, a de 'homem trans'. Essa se constrói diferenciando-se da identidade lésbica e, também, de expressões de gênero de outros grupos que tiveram seus corpos assignados como femininos ao nascimento, mas que contestam essa assignação sem, contudo, se afirmarem 'homens' de forma constante. Afirma-se que a emergência dos 'homens trans' tem sido potencializada pelo estabelecimento do processo transexualizador no SUS. Discutem-se o uso do termo ""homem trans"" e algumas características comuns a tais sujeitos. Problematizam-se a complexidade de seus processos de autorreconhecimento e construção de masculinidades, sua rápida capacidade de indiferenciação a partir de modificações corporais e, alguns dos efeitos políticos e subjetivos, da visibilidade e da indiferenciação.",,,Artigo em Periódico,Artigo em Periódico,,Estudos Feministas,UFSC,,Brazil,-26.88663712,-49.11222104
Rodovalho_A_Cis.pdf,,,rodovalho_a_cis,application/pdf,pdf,/objects/thumbs/rodovalho_a_cis_th.jpg,,2017,Amara Moira Rodovalho,O cis pelo trans,Cisgeneridade; Transfeminismos,,,,Artigo em Periódico,Artigo em Periódico,,Estudos Feministas,UFSC,,Brazil,-26.88663712,-49.11222104
York_A_Manifestacoes.pdf,,,york_a_manifestacoes,application/pdf,pdf,/objects/thumbs/york_a_manifestacoes_th.jpg,,2020,Sara Wagner York; Megg Rayara Gomes Oliveira; Bruna Benevides,Manifestações textuais (insubmissas) travesti,Travestilidades; Manifesto; Co-autoria,"cisgeneridade-binária, heterossexual e compulsória como regime de governamentalidade (Michel FOUCAULT, 1979) determinou, por muito tempo, pressupostos que abarcam marcas profundas com seus estabelecidos normativos. As normas, marcadas pelo regime, acorrentaram as multiplicidades sexuais e de gênero fora daquilo que compreendia o social no Brasil e em boa parte do mundo. A marca repulsiva e marginalizada impressa pelos pressupostos da cis-hetero-governamentalidade de identidades de gênero e sexo no Brasil tem sua emergência a partir dos estudos que nomeavam como substantivo masculino as travestis, os primeiros corpos ciborgues (Donna HARAWAY, 1994) do/no Brasil. Além disso, tal dinâmica marcava corpos travestis em uma condição de não lugar. Muitos estudos abriram trincheira por vales colonizados na tentativa de descrever as subjetividades travestis, além dos essencialismos de gênero (Paul B. PRECIADO, 2017). Este manifesto, aos moldes de outros, busca apresentar, a partir de um pensamento travesti, caminhos atravessados pelo transfeminismo e transativismo, para um futuro travesti, marcado pela luta, afeto e pela presença destas vidas e práticas (transformadoras) em todos os (anti)estratos sociais que operam com o poder da negatividade (Jack HALBERSTAN, 2012).",,,Artigo em Periódico,Artigo em Periódico,,Estudos Feministas,UFSC,,Brazil,-26.88663712,-49.11222104
Cavacalnti_A_Contagios.pdf,,,cavacalnti_a_contagios,application/pdf,pdf,/objects/thumbs/cavacalnti_a_contagios_th.jpg,,2019,Céu Cavalcanti; Vanessa Sander,"Contágios, fronteiras e encontros: articulando analíticas da cisgeneridade por entre tramas etnográficas em investigações sobre prisão",Encarceramento; Cisgeneridade; Co-autoria; Etnografia,"Este artigo propõe um diálogo entre duas pesquisadoras que investigam temas afins: as experiências de travestis e transexuais em privação de liberdade. Partindo das formulações de Donna Haraway (1995), pretendemos debater sobre a particularidade e a corporificação de toda visão etnográfica através de um eixo de diferenciação central para nossas vivências em campo: a identidade de gênero. Céu Cavalcanti discute sobre os encontros etnográficos e o desenvolvimento de sua pesquisa enquanto uma pessoa trans; Vanessa Sander faz o mesmo debatendo os caminhos de sua investigação como pessoa cisgênera. Os diálogos e as ressonâncias entre as duas vozes que aqui se encontram possibilitam um afluente de conexões, em que as tramas interseccionais que circundam nossa visão são objeto inicial de análise. Nas dinâmicas teórico-metodológicas temos um ponto de encontro das nossas perspectivas que nos convidam a conversar sobre o elemento central deste texto: as identificações de cisgeneridade e transgeneridade nos próprios marcadores das pesquisadoras que se propõem a produzir conhecimento junto à pluralidade das vivências trans.",,,Artigo em Periódico,Artigo em Periódico,,Cadernos Pagu,UNICAMP,,Brazil,-22.8182415,-47.0646455
Caetano_A_Contaminacao.pdf,,,caetano_a_contaminacao,application/pdf,pdf,/objects/thumbs/caetano_a_contaminacao_th.jpg,,2024,Morgan Franzoni Caetano,Contaminação clubber: corpo e performance na cena de São Paulo,Artes; Antropologia; Antropologia Urbana; Corpo; Sociabilidade,"O presente artigo busca investigar a relação entre corpo, cidade e performance na cena clubber de festas independentes de música eletrônica da cidade de São Paulo. Partindo de uma breve apresentação do campo, este trabalho desenvolve as noções de cena, contaminação e performance, entendendo o corpo como um aspecto central da cena clubber. A ideia de contaminação surge nesta pesquisa como uma perspectiva clubber que parte do próprio campo – no texto, é desenvolvida com base na teoria de Mary Douglas e na figura do monstro. A noção de performance é abordada em diferentes perspectivas: de modo a evidenciar uma arquitetura relacional própria da cena clubber. O texto é fruto da pesquisa de Iniciação Científica realizada entre 2019 e 2020, que foi atravessada pelo isolamento social da pandemia de Covid-19, e teve como principais interlocutories integrantes do coletivo artístico Metanoia.",,,Artigo em Periódico,Artigo em Periódico,,Ponto Urbe,USP,,Brazil,-23.56092993,-46.73093151
