filename,external,worldcat,objectid,format,display_template,image_thumb,image_small,date,creator,title,subject,abstract,synopsis,description,classification,genre,publisher,journal,university,address,country,latitude,longitude
,,https://search.worldcat.org/title/1246252556?oclcNum=1246252556,oliveira_b_nem,application/pdf,pdf,/objects/thumbs/oliveira_b_nem_th.jpg,,2020,Megg Rayara Gomes de Oliveira,Nem ao centro nem a margem: corpos que escapam às normas de raça e gênero,Educação; Raça,,"Corpos que escapam às normas de raça e de gênero é composto por 10 artigos - alguns publicados em revistas científicas - que discutem relações étnico-raciais, gênero e diversidade sexual. Categorias como bicha, viado, gay afeminado, travestilidade, transexualidade, infância, mulher, dentre outras, são discutidas a partir do conceito interseccional presente em todos os textos. Nenhuma dessas categorias é tratada de forma estática, cristalizada. A autora reconhece que cada uma delas está em constante negociação, adaptação, transformação. Adotando uma postura genealógica, Megg Rayara Gomes de Oliveira transita por áreas variadas do conhecimento como arte africana e afro-brasileira, religião, iconografia religiosa cristã, arte queer, cinema, história em quadrinhos, movimento social de negras e negros e nos convida a refletir a respeito dos processos de apagamento que operam sobre pessoas consideradas, pela sociedade e pela academia, como menos humanas.",,Livro,Produção Acadêmica,Devires,,,"Avenida Rui Barbosa, 239, Centro, Simões Filho, Bahia, Brasil",Brazil,-12.78668182,-38.4002103
,,,oliveira_b_diabo,application/pdf,pdf,/objects/thumbs/oliveira_b_diabo_th.jpg,,2020,Megg Rayara Gomes de Oliveira,O diabo em forma de gente: (r)resistências de gays afeminados na educação,Educação,,"O Diabo em Forma de Gente: (r)existências de gays afeminados, viados e bichas pretas na educação é uma pesquisa de doutorado, e como nome informa, se concentra no espaço escolar, um lugar caracterizado pelo controle de corpos e pela produção de subjetividades e se orienta a partir de duas formas de segregação e preconceito, o racismo e a homofobia. Embora a pesquisa adote um tom de denúncia, reconhecendo que o dispositivo de sexualidade e o dispositivo de racialidade operam sobre as experiências de homossexuais masculinos negros, que passam inclusive por um processo de demonização, o interesse da autora foi destacar as estratégias de enfrentamento desenvolvidas por 4 docentes negros que expressam orientação sexual discordante da norma heterossexual. A pesquisa constatou que as resistências desenvolvidas são múltiplas e emergem, na maioria das vezes, dos discursos racistas e homofóbicos. Assim, as categorias gays afeminado, viado, bicha e preta são ressignificadas pelos próprios sujeitos aos quais elas se referem, e se materializam como possibilidades concretas de enfrentamento. Para fazer esse debate a autora, Megg Rayara Gomes de Oliveira, se utilizou do método auto-biográfico desenvolvido pelo professor doutor Marcio Cawetano e adotou uma postura interseccional para mostrar que são múltiplos os marcadores que operam para interditar socialmente uma pessoa. O texto aqui apresentado é um exercício de pesquisa caracterizado pelo revezamento entre várias áreas do conhecimento e contribui de forma bastante potente para a pesquisa acadêmica e também para a construção de uma sociedade menos normalizadora. Embora a escola seja apresentada como um espaço de controle sobre os corpos, especialmente aqueles que escapam às normas de raça e de gênero considerado hegemônicos, ela também pode apresentar áreas de escape e assim evitar que o controle se efetive da forma pretendida. A pesquisa, escrita em primeira pessoa por uma travesti preta, moradora da cidade de Curitiba, mostra que os mecanismos de controle que conduzem pessoas negras, gays afeminados, viados e bichas ao abandono do sistema educacional não são eficazes em sua totalidade e muitos corpos escapam e a formação acadêmica se revela como uma estratégia de enfrentamento bastante poderosa. O Diabo em forma de gente construído pelos discursos normatizadores e normalizadores é assumido por quem antes era a vítima dele. O Diabo materializado na figura do gay afeminado, do viado e da bicha preta coloca em debate as múltiplas possibilidades de (r)existências que questionam os dispositivos de poder que queriam destruí-lo. O racismo e a homofobia se interseccionam e continuam operando sobre as existências de gays afeminados, viados e bichas pretas como dispositivos de poder. Mas, como propõe Michel Foucault (1986 - 1984), onde há poder há resistências. Há existências.",,Livro,Produção Acadêmica,Devires,,,"Avenida Rui Barbosa, 239, Centro, Simões Filho, Bahia, Brasil",Brazil,-12.78668182,-38.4002103
,,https://search.worldcat.org/title/1244180598,odara_b_pedagogia,application/pdf,pdf,/objects/thumbs/odara_b_pedagogia_th.jpg,,2020,Thiffany Odara,Pedagogia da desobediência: travestilizando a educação,Educação; Travestilidades,,"O livro Pedagogia da Desobediência: Travestilizando a Educação da pesquisadora, pedagoga e Iyálorixá Thiffany Odara conta sobre a produção de saberes travestis na cidade de Salvador. Costurando as histórias do movimento trans com os diálogos teóricos do feminismo negro, Thiffany propõe travestilizar a educação como forma de construção de espaços de conhecimento que sejam para todas as pessoas. Uma pedagogia transgressora que diz de reinvindicação e acesso, em especial das pessoas trans, a condição de humanidade. Uma publicação que abre caminhos para outras pedagogias e incita a desobediência do CIStema. Thais Faria Castro (Editora) Um mergulho em águas profundas! Essa é uma das inúmeras definições possíveis das sensações experimentadas as leitoras (es) de Pedagogia da desobediência: Travesti lizando a educação. Como um convite para reatualizarmos nossas concepções sobre os feminismos negros e as produções transfeminista Thiffany Odara nos apresenta o impacto da produção intelectual de uma mulher negra, baiana, candomblecista trans no campo da educação. Para além de um magnifico resgate histórico da luta das travestis na cidade de Salvador o texto nos leva a entender o caráter pedagógico desse movimento, e como este foi e é fundamental para sobrevivência dessas ativistas; bem como os ensinamentos e legados deixados para as futuras gerações. Ao resgatar o pensamento clássico dos feminismos negros e transfeminismos também fica evidente a provocação sobre a necessidade urgente da articulação entre essas teorias e práticas para melhor entendermos o trilhar do caminho que nos é proposto. As reflexões tornam-se ainda mais potentes quando a autora intersecciona sua formação enquanto pedagoga para deslocarmos essas discussões para o campo da educação; pensando a mesma para além do espaço escolar. Thiffany transforma as dores e violências sofridas em sua trajetória educacional em uma ordem imperativa: É preciso desobedecer e travestilizar! Os apontamentos para a construção de uma educação transgressora se fazem presente durante toda a construção do pensamento da autora que sem dúvidas nos aponta os possíveis caminhos para pensarmos conceitos e formulações inéditas em campos distintos do conhecimento.",,Livro,Produção Acadêmica,Devires,,,"Avenida Rui Barbosa, 239, Centro, Simões Filho, Bahia, Brasil",Brazil,-12.78668182,-38.4002103
,,https://search.worldcat.org/title/1390629402,favero_b_psicologia,application/pdf,pdf,/objects/thumbs/favero_b_psicologia_th.jpg,,2022,Sofia Favero,Psicologia suja,Psicologia,,"Neste livro, Sofia Favero explora a potência dos afetos infames, dentre eles a raiva, culpa e tristeza, como forma de dar outros destinos à vivência de ser minorizada. As cenas em que pessoas são atingidas pelo racismo e sexismo são capazes de gerar respostas emocionais complexas, ligadas a sensações que, paradoxalmente, nos educam a lutar contra. Em diálogo com a negatividade queer e os estudos críticos da branquitude, Favero conjuga a brutalidade destinada a travestis no Brasil como estratégia para imaginar outros mundos, propondo uma leitura psicológica sobre as constantes humilhações e assujeitamentos a que mulheres, pessoas negras, gordas e LGBT+s têm sido expostas em seus cotidianos. Articulando conceitos e saberes como pulsão de morte, erotismo, cancelamento, afropessimismo e destransição, ela aposta na sujeira como forma de resistir ao imperativo da limpeza e da assepsia que as recentes “clínicas da diversidade” têm investido. No lugar disso, a autora encara o sujo como uma pergunta ativa. O que fazemos com a violência anti-trans disseminada na cultura? Diante do quadro mortífero causado pela desigualdade social e pela injustiça epistêmica, Sofia escreve com fúria sobre experiências pessoais, na busca de sugerir à clínica uma postura mais sacana, criminosa, no próprio ato de ouvir. Sujas são aquelas pessoas que não são nem sujeito (condição política) nem objeto (condição de desejo). Psicologia Suja é um livro provocativo e certamente marca a força dos estudos trans nesse território denso que é o campo do cuidado, propondo usos políticos da irritação e do arrependimento. Afinal, uma clínica software já conhecemos, podemos fortalecer uma clínica malware? Esse é o ousado convite que Sofia faz a quem lê.",,Livro,Produção Acadêmica,Devires,,,"Avenida Rui Barbosa, 239, Centro, Simões Filho, Bahia, Brasil",Brazil,-12.78668182,-38.4002103
,,,favero_b_pajuba,application/pdf,pdf,/objects/thumbs/favero_b_pajuba_th.jpg,,2020,Sofia Favero,Pajubá-terapia: ensaios sobre a cisnorma,Psicologia; Cisgeneridade,,"Escrito pela psicóloga Sofia Favero, o livro Pajubá-Terapia: ensaios sobre a cisnorma chega ao público leitor com a proposta de ampliar o debate sobre um recorte da perspectiva psico-clínica tradicional e apresenta diferentes possibilidades de subversão no campo da saúde mental. A participação cada vez mais frequente de pessoas trans e travestis na psicologia tem feito com que os saberes psicopatológicos sejam desestabilizados. Ao mesmo tempo, novas disputas estão em surgimento, situando a “diversidade” no centro de determinados processos terapêuticos.

Sofia, em seu livro, faz uma crítica ao que está sendo chamado de “clínica LGBT” – reconhecendo como esse âmbito não tem se desligado de uma tradição essencialista, na qual as posicionalidades de gênero, sobretudo, seriam vistas desde sempre enquanto adoecimentos ou expressões de um sofrimento interno. A autora se dedica a desmantelar a crença de que as transexualidades, travestilidades e transgeneridades se tratariam de demandas terapêuticas em todo e qualquer caso, a partir de uma escrita sarcástica, biográfica e pouco comprometida com uma “verdade” sobre a identidade.",,Livro,Produção Acadêmica,Editora,,,,Brazil,,
,,,brasileiro_b_devoracoes,application/pdf,pdf,/objects/thumbs/brasileiro_b_devoracoes_th.jpg,,2018,Castiel Vitorino Brasileiro,"Devorações: descolonizando corpos, desejos e escritas",Artes,,,,Livro,Produção Acadêmica,Issu,,,"R. Visc. do Rio Branco, 886 - Vila Jardini, Sorocaba - SP, 18044-000, Brazil",Brazil,-23.51153393,-47.47617223
,,https://search.worldcat.org/title/1285001019,nascimento_b_transfeminismo,application/pdf,pdf,/objects/thumbs/nascimento_b_transfeminismo_th.jpg,,2021,Letícia Carolina Nascimento,Transfeminismo,Transfeminismos,,"Letícia Nascimento, em Transfeminismo, através de uma linguagem acessível e didática, traz ao público geral explicações necessárias sobre os conceitos de gênero, transgeneridade, mulheridade, feminilidade e feminismo. Mostra como cada vez mais é necessário que as pessoas estejam abertas às diversas existências que não necessariamente se encaixam no organização binária e cisgênera do mundo. Um primeiro passo nesse sentido é conhecer as experiências de quem faz parte desses grupos e esse livro, escrito por uma mulher travesti, negra e gorda, que está presente nos meios acadêmicos e é inspiração para outras mulheres transexuais e travestis, apresenta essas vivências, traz conceituações históricas e situa o transfeminismo dentro dos demais feminismos existentes.",,Livro,Produção Acadêmica,Jandaíra,,,,Brazil,,
,,https://search.worldcat.org/title/1374338677,brasileiro_b_quando,application/pdf,pdf,/objects/thumbs/brasileiro_b_quando_th.jpeg,,2022,Castiel Vitorino Brasileiro,Quando o sol aqui não mais brilhar: a falência da negritude,Negritude; Raça,,"A civilização brasileira menospreza os nomes dos povos de civilizações africanas – aqui enraizados há quase 500 anos – e prefere o sofismo de chamá-los pelo nome da commodity transportada em navios negreiros: os negros. Cria-se assim, em tese, um círculo vicioso de racismo institucional e sistêmico que retroalimenta o racismo estrutural no Brasil. A brasilidade alcança cotidianamente seu objetivo de matar as almas africanas brasileiras, e assim segue especializando a civilização brasileira num africanicídio.
Mestre Renato Santo.

A racialização negra não é um motivo de orgulho, mas uma distração. No Brasil vivemos um desafio semantico, um dos pilares de nossa colonização: Ser Negro.
Castiel Vitorino Brasileiro.",,Livro,Produção Acadêmica,n-1 edições,,,,Brazil,,
,,https://search.worldcat.org/title/1366104515,leal_b_trans,application/pdf,pdf,/objects/thumbs/leal_b_trans_th.jpg,,2017,Dodi Leal,De trans pra frente,Artes,,"Ser trans pra mim é libertar-se. É não ser ator nem atriz: é ser atroz. É ir atrás. Estar à frente. É enfrentar. É atuar sobre si mesma. É assumir riscos. É ter a dádiva de duvidar da vida. Ser Trans é ter peito. E também é não ter. Ser Trans é genial, não genital. Não é do caralho, nem de xoxota. É de corpo inteiro. É reinventar-se e criar sobre a própria existência. Ser Trans é confuso, é borrar os limites, é rascunho. Ser Trans é poesia. É assumir-se corpo. Ir além. Ser criação e criadora. A médica e a monstra. Ser Trans é divino. É obra de d'eus. De todos os eus que me constituem. Não é obra das trevas. É obra das travas. Ser trans é um ato de coragem. É um campo de batalha. Ser trans é entregar-se. É não abrir mão de si. O que pode ser, algumas vezes, solitário. Mas tenho me encontrado em outras solidões. E tenho percebido que não estou sozinha. Não estamos. Eu soul Trans. E celebro minha existência. Celebro as nossas vidas, nossas conquistas. Se eu não fosse Trans, gostaria de ser",,Livro,Produção Acadêmica,Patúa,,,"Rua Luís Murat, 40 Pinheiros - São Paulo",Brazil,-23.55587207,-46.68399035
,,,benvenutty_b_fernanda,application/pdf,pdf,/objects/thumbs/benvenutty_b_fernanda_th.jpg,,2022,Fernanda Benvenutty; Silvana Nascimento; Lux Lima,Fernanda Benvenutty: uma política travesti,Travestilidades; Movimentos Sociais; História; Co-autoria,,"Artista circense. Carnavalesca. Parteira. Mãe. Militante. Travesti. Fernanda Benvenutty abriu caminhos para uma política travesti e foi precursora do movimento trans no Brasil. Em meio à ditadura militar, no interior da Paraíba, se tornou feminina. Entre desfiles na avenida, salas de parto, passeatas e reuniões políticas, rompeu preconceitos e virou referência. Sua biografia reconstitui essa trajetória, cuja única constância foi a busca por alcançar o que diziam ser impossível.",,Livro,Produção Acadêmica; Co-autoria,Patuá,,,"Rua Luís Murat, 40 Pinheiros - São Paulo",Brazil,-23.55587207,-46.68399035
,,,silva_b_bajuba,application/pdf,pdf,/objects/thumbs/silva_b_bajuba_th.jpg,,2021,Jovanna Baby Cardoso da Silva,Bajubá Odara: resumo histórico do nascimento do movimento de travestis no Brasil,Travestilidades; Movimentos sociais,,,,Livro,Resumo Histórico,FONATRANS,,,,Brazil,,
Depaula_DT_Jornal.pdf,,,depaula_dt_jornal,application/pdf,pdf,/objects/thumbs/depaula_dt_jornal_th.jpg,,2022,Carú de Paula Seabra,Jornal de Exystêncya: Conjurando terrytóryos férteys em tempos de fym de mundo,Psicologia; Transmasculinidades,"O jornal da existência visa habitar a travessia do tempo linear colonial, capitalístico, racializante. Manifesta-se sob um irredutível compromisso ético e político que a clínica prescinde: a conjuração do que impede que a pulsão de vida prevaleça na condução da existência. Uma clínica radicalmente comprometida com a criação de possibilidades para vidas dignas, buscando a garantia da autonomia, ainda que (e sobretudo) em contextos de extrema violência e sofrimento psíquico. Neste sentido, a presente dissertação se inscreve no campo das distintas teorias e práticas da Psicologia que buscam enfrentar os pontos de asfixia do presente, contribuindo para sua transformação – neste caso, no plano específico da subjetividade",,,Teses e Dissertações,Dissertação (Mestrado),,,PUCSP,,Brazil,-23.54869905,-46.64990237
Vergueiro_DT_Inflexoes.pdf,,,vergueiro_dt_inflexoes,application/pdf,pdf,/objects/thumbs/vergueiro_dt_inflexoes_th.jpg,,2015,Viviane Vergueiro,Por inflexões decoloniais de corpos e identidades de gênero inconformes,Cultura e Sociedade; Cisgeneridade; Decolonialidade; Autoetnografia; Identidade,"Este trabalho tem como propósitos (1) fundamentar e caracterizar as categorias analíticas de cisgeneridade e cisnormatividade, propondo-as como relevantes para reﬂexões políticas, acadêmicas, existenciais sobre as diversidades de corpos e de identidades de gênero, assim como tecer reﬂexões autoetnográﬁcas atravessadas pelas localizações, limitações e potências intelectuais desta autoetnógrafa acerca (2) dos dispositivos de poder institucionais e não institucionais cisnormativos que exercem colonialidades sobre estas diversidades, bem como sobre (3) as possibilidades de resistência e enfrentamento a estes cistemas de poder interseccionalmente constituídos. Para cumprir tais propósitos, a dissertação é composta por dois movimentos: no primeiro, o objetivo é promover diálogos sobre alguns dos conceitos que inspiram a proposição analítica de cisgeneridade, e trazem possibilidades epistêmicas e metodológicas ao trabalho, como os de autoetnograﬁa, interseccionalidade, heterossexualidade, e branquitude. A partir de referenciais trans+feministas, queer e decoloniais, pretendese caracterizar a cisgeneridade como normatividade sobre corpos e identidades de gênero que os naturaliza e idealiza, em fantasias ciscoloniais, como pré-discursivos, binários e permanentes. O segundo movimento se constitui pela caracterização, a partir de análises autoetnográﬁcas, de processos cisnormativos que estabelecem colonialidades do saber, poder e ser que operam violentamente através de cistemas. Contra estes processos cisnormativos e colonialidades cistêmicas, tentamos elaborar alguns caminhos decoloniais que possam promover autodeterminação, autonomia, dignidade e liberdade às diversidades corporais e de identidades de gênero, particularmente aquelas inconformes, interseccionalmente, às cisnormatividades.",,,Teses e Dissertações,Dissertação (Mestrado),,,UFBA,,Brazil,-12.74983165,-38.48214151
Rego_DT_Combinamos.pdf,,,rego_dt_combinamos,application/pdf,pdf,/objects/thumbs/rego_dt_combinamos_th.jpg,,2021,Yordana Lara Pereira Rego,"Combinamos de não morrer? Transfobia, racismo e resistência à necropolítica entre pessoas trans negras em Goiás",Antropologia; Negritudes; Ciências Sociais,"Esta dissertação problematiza antropologicamente a intersecção entre racismo e
transfobia a partir de narrativas de vida de pessoas negras transexuais e travestis
residentes em Goiás. Traz, como objetivo, interpretar relações entre o racismo e a
transfobia como técnicas de governabilidade dos corpos e das existências trans
negras. Para compreender os entrecruzamentos de eixos, a interseccionalidade é a
principal ferramenta teórico/metodológica utilizada, pois, além de propor ampliação
nas possibilidades de diálogos entre diversas áreas do conhecimento, possibilita um
debate para além da hierarquização de opressões, buscando captar e analisar as
singularidades que se estabelecem em cada experiência narrada. Nesse sentido,
lança mão do conceito de necropolítica, uma vez que as narrativas estudadas
permitem questionar acerca do lugar do Estado na produção e reprodução de
violências inscritas em seus corpos e das dificuldades que enfrentam para acessar
algumas políticas públicas. Em especial, as que se referem ao nome social e/ou
retificação de registro civil, uma vez que a busca pelo reconhecimento de seus nomes,
significa também, para as pessoas interlocutoras, o reconhecimento de suas
identidades de gênero. Por fim, o texto visa destacar a potência desestabilizadora das
resistências estabelecidas por essas pessoas diante de processos sociais e culturais.",,,Teses e Dissertações,Dissertação (Mestrado),,,UFG,,Brazil,-15.94122207,-50.13493594
,,,,,,,,2012,Adriana Sales,Travestilidades e escolas nas narrativas de alunas travestis,Educação; Travestilidades; Subjetividade,,,,Teses e Dissertações,Dissertação (Mestrado),,,UFMT,,Brazil,-15.60965936,-56.06511419
Lanz_DT_Corpo.pdf,,,lanz_dt_corpo,application/pdf,pdf,/objects/thumbs/lanz_dt_corpo_th.jpg,,2014,Leticia Lanz,O corpo da roupa: a pessoa transgênera entre a transgressão e a conformidade com as normas de gênero,Sociologia; Passabilidade; Cisgeneridade; Identidade; CIências Sociais,"Muito se escreveu e ainda se escreve sobre travestis, transexuais, crossdressers e dragqueens no Brasil, mas praticamente não há registro escrito a respeito da condição transgênera - ou transgeneridade - como é internacionalmente conhecido o fenômeno sociológico de desvio ou transgressão das normas de conduta estabelecidas pelo dispositivo binário de gênero, fato que caracteriza todas essas identidades, fazendo com que elas sejam consideradas gênero-divergentes e, em razão disso, marginalizadas, excluídas e estigmatizadas pela sociedade. Transgênero é um termo ?guarda-chuva', destinado a reunir debaixo de si todas essas identidades gênero-divergentes, ou seja, identidades que, de alguma forma e em algum grau, descumprem, ferem e/ou afrontam o dispositivo binário de gênero. Transgênero tampouco diz respeito ao gay (ou lésbica ou bi) ?mais afetado', como não deve ser considerado como doença mental ou comportamento depravado, tratando-se apenas e tão somente de uma circunstância sociopolítica de inadequação às normas de conduta de gênero. A pessoa transgênera vive permanentemente dividida e tensionada entre a transgressão dessas normas e a busca pela conformidade com elas, só que, em geral, dentro de uma categoria de gênero que é oposta àquela em que a pessoa foi enquadrada ao nascer. Mas o ?estado de conflito' em que a pessoa transgênera é habitualmente descrita nunca foi dela com ela mesmo, ou da sua subjetividade com a sua corporalidade, mas a consequência imediata da sua transgressão das normas sociais de gênero, através de ?pensamentos, palavras, atos e omissões' . Se o dispositivo binário de gênero fosse algo ao menos flexível, se não comportasse apenas duas e somente duas identidades socialmente legitimadas (masculino e feminino) não haveria a menor possibilidade de ocorrer qualquer tipo de transgressão de gênero, nenhuma pessoa seria classificada como transgênero ou gênero-divergente. Neste trabalho perguntamos até que ponto a transição de um gênero para outro pode ser considerada transgressão do dispositivo binário de gêneros ou constitui apenas ?uma outra forma' de confirmação e ratificação dessa mesma norma? Dito de outra forma, até que ponto a transição de um gênero para outro representa afronta e violação das normas e estereótipos de gênero ou não passa de premeditada e deliberada estratégia de reinserção ao dispositivo binário de gênero? Isso nos demanda investigar em que o comportamento transgênero viola e subverte a ordem binária de gêneros, apresentando elementos de transgressão e de subversão do dispositivo de gênero e em que ele apenas reifica e ratifica essa mesma ordem, apresentando elementos de conformidade e aceitação da ordem binária de gêneros. Palavras-chave: transgênero, transgeneridade, transgressão de gênero, estudos transgêneros, travesti, transexual, crossdresser, crossdressing, travestismo masculino, identidade de gênero, identidades gênero-givergentes, expressão de gênero, dispositivo binário de gênero, normas de gênero, transfobia, transição, passabilidade.",,,Teses e Dissertações,Dissertação (Mestrado),,,UFPR,,Brazil,-25.4264354,-49.2619218
