filename,objectid,format,title,date,Author(s),Title (EN) (DeepSeek),Title (EN) (Copilot),Título (ES) (Deepseek),Titulo (ES) (Copilot),Co-author 1,Co-author 2,Type,Sub-Type,Publisher,Journal,University (PT),University (Acronym),Área (PT),Area (EN),Area (ES),Resumo (PT),Abstract (EN),Resumen (ES),Palavras-chave (PT),Keywords (EN),Palavras-clabe (ES),Link,,
Rego_DT_Combinamos.pdf,rego21,application/pdf,"Combinamos de não morrer? Transfobia, racismo e resistência à necropolítica entre pessoas trans negras em Goiás",2021,Yordana Lara Pereira Rego,"Linn(da) Who Cries Out: Poetic Dissidences, Moving Corporeality, and Insurgent Aesthetics","Did We Agree Not to Die? Transphobia, Racism, and Resistance to Necropolitics Among Black Trans People in Goiás","¿Acordamos no morir? Transfobia, racismo y resistencia a la necropolítica entre personas trans negras en Goiás","¿Quedamos en no morir? Transfobia, racismo y resistencia a la necropolítica entre personas trans negras en Goiás",,,Dissertation/Thesis,Master's Thesis,,,Universidade Federal de Goiás,UFG,Antropologia Social,Social Anthropology,Antropología Social,,,,,,,Link,,
Reidel_DT_Pedagogia.pdf,reidel13,application/pdf,A pedagogia do salto alto. Histórias de professoras transexuais e travestis na educação brasileira,2013,Marina Reidel,The Pedagogy of High Heels: Stories of Transsexual and Travesti Teachers in Brazilian Education,The High-Heel Pedagogy: Stories of Transsexual and Travesti Teachers in Brazilian Education,La pedagogía del tacón alto. Historias de profesoras transexuales y travestis en la educación brasileña,La pedagogía del tacón alto: historias de profesoras transexuales y travestis en la educación brasileña,,,Dissertation/Thesis,Master's Thesis,,,Universidade Federal do Rio Grande do Sul,UFRGS,Educação,Education,Educación,,,,,,,Link,,
Reis_DT_Somos.pdf,reis18,application/pdf,Somos feitas de histórias: (auto)etnografia multilocal com travestis,2018,Andreia Resende Dos Reis,We Are Made of Stories: Multi-Sited (Auto)Ethnography with Travestis,We Are Made of Stories: A Multi-Local (Auto)Ethnography with Travestis,Estamos hechas de historias: (auto)etnografía multilocal con travestis,Estamos hechas de historias: (auto)etnografía multilocal con travestis,,,Dissertation/Thesis,PhD Thesis,,,Universidade Católica de Minas Gerais,PUC-MG,Psicologia,Psychology,Psicología,,,,,,,Link,,
Rodovalho_A_Cis.pdf,rodovalho17,application/pdf,O cis pelo trans,2017,Amara Moira Rodovalho,The Cis Through the Trans,The Cis Through the Trans,Lo cis a través de lo trans,Lo cis a través de lo trans,,,Paper,Journal Article,,Estudos Feministas,,,,,,,,,,,,Link,,
,,,A queda para o alto,1982,Anderson Herzer,The Fall Upward,The Fall Upward,La caída hacia arriba,La caída hacia arriba,,,Book,,Vozes,,,,,,,,,,,,,–,,
,,,Erro de pessoa: Joana ou João?,1984,João Nery,Human Error: Joana or João?,Mistaken Identity: Joana or João?,Error humano: ¿Joana o João?,Error de persona: ¿Joana o João?,,,Book,,Record,,,,,,,,,,,,,–,,
,,,"Meu corpo, minha prisão: Autobiografia de um transexual",1985,Lorys Ádreon,"My Body, My Prison: Autobiography of a Transsexual","My Body, My Prison: Autobiography of a Transsexual","Mi cuerpo, mi prisión: Autobiografía de un transexual","Mi cuerpo, mi prisión: Autobiografía de un transexual",,,Book,,Marco Zero,,,,,,,,,,,,,–,,
,,,A Princesa: Depoimentos de um travesti brasileiro a um líder das Brigadas Vermelhas,1995,Fernanda Albuquerque,The Princess: Testimonies of a Brazilian Transvestite to a Red Brigades Leader,The Princess: Testimonies of a Brazilian Travesti to a Red Brigades Leader,La Princesa: Testimonios de una travesti brasileña a un líder de las Brigadas Rojas,La Princesa: Testimonios de una travesti brasileña a un líder de las Brigadas Rojas,Maurizio Jannelli,,Book,,Nova Fronteira,,,,,,,,,,,,,–,,
,,,Liberdade ainda que profana,1998,Ruddy Pinho,"Freedom, Even If Profane","Freedom, Even if Profane",Libertad aunque sea profana,Libertad aunque sea profana,,,Book,,"Razão Cultural ",,,,,,,,,,,,,–,,
,,,"Muito prazer, Roberta Close",1998,Roberta Close,"Pleased to Meet You, Roberta Close","Pleased to Meet You, Roberta Close","Mucho gusto, Roberta Close","Mucho gusto, Roberta Close"," Lucia Rito",,Book,,Rosa dos Tempos,,,,,,,,,,,,,–,,
,,,Viagem solitária: memórias de um transexual trinta anos depois,2011,João Nery,Solitary Journey: Memoirs of a Transsexual Thirty Years Later,Solitary Journey: Memories of a Transsexual Thirty Years Later,Viaje solitario: memorias de un transexual treinta años después,Viaje solitario: memorias de un transexual treinta años después,,,Book,,Leya,,,,,,,,,,,,,–,,
,,,Thammy: nadando contra a corrente,2015,Thammy Miranda,Thammy: Swimming Against the Current,Thammy: Swimming Against the Current,Thammy: nadando contra la corriente,Thammy: nadando contra la corriente,Marcia Zanelatto,,Book,,Best Seller,,,,,,,,,,,,,–,,
,,,Transfeminismo – teoria e prática,2015,Jaqueline Gomes de Jesus,Transfeminism – Theory and Practice,Transfeminism – Theory and Practice,Transfeminismo - teoría y práctica,Transfeminismo – teoría y práctica,,,Book,Compilation,Metanoia,,,,,,,,,,,,,–,,
,,,E se eu fosse puta,2016,Amara Moira Rodovalho,What If I Were a Whore,What If I Were a Whore,Y si yo fuera puta,¿Y si yo fuera puta?,,,Book,,Hoo,,,,,,,,,,,,,–,,
,,,Meu nome é Amanda,2016,Amanda Guimarães,My Name Is Amanda,My Name Is Amanda,Mi nombre es Amanda,Mi nombre es Amanda,Lielson Zeni,,Book,,Fábrica 321,,,,,,,,,,,,,–,,
,,,De trans pra frente,2017,Dodi Leal,From Trans and Beyond,From Trans Onward,De trans hacia adelante,De trans en adelante,,,Book,,Patúa,,,,,,,,,,,,,–,,
,,,"Devorações - descolonizando corpos, desejos e escritas",2018,Castiel Vitorino,"Devourings – Decolonizing Bodies, Desires, and Writings","Devourings – Decolonizing Bodies, Desires, and Writings","Devoraciones - decolonizando cuerpos, deseos y escritos","Devoraciones – descolonizando cuerpos, deseos y escrituras",,,Book,,Issu,,,,,,,,,,,,,Link,,
,,,"Eu, travesti: Memórias de Luísa Marilac",2019,Luísa Marilac,"I, Transvestite: The Memoirs of Luísa Marilac","I, Travesti: Memoirs of Luísa Marilac","Yo, travesti: Memorias de Luísa Marilac","Yo, travesti: Memorias de Luísa Marilac",Nana Queiroz,,Book,,Record,,,,,,,,,,,,,–,,
,,,Molhado de vermelho: poemas de transição,2019,Guilherme Almeida,Wet with Red: Poems of Transition,Soaked in Red: Poems of Transition,Mojado de rojo: poemas de transición,Mojado de rojo: poemas de transición,,,Book,,Devires,,,,,,,,,,,,,–,,
,,,Crianças trans: infâncias possíveis,2020,Sofia Favero,Trans Children: Possible Childhoods,Trans Children: Possible Childhoods,Niños trans: infancias posibles,Niñeces trans: infancias posibles,,,Book,,Devires,,,,,,,,,,,,,–,,
,,,Nem ao centro nem a margem – corpos que escapam às normas de raça e gênero,2020,Megg Rayara Gomes de Oliveira,Neither Center Nor Margin – Bodies That Escape Norms of Race and Gender,Neither Center Nor Margin – Bodies That Defy Racial and Gender Norms,Ni en el centro ni en el margen - cuerpos que escapan a las normas de raza y género,Ni al centro ni al margen – cuerpos que escapan a las normas de raza y género,,,Book,,Devires,,,,,,,,,,,,,–,,
,,,O diabo em forma de gente – (r)resistências de gays afeminados na educação,2020,Megg Rayara Gomes de Oliveira,The Devil in Human Form – (R)esistances of Effeminate Gay Men in Education,The Devil in Human Form – (Re)Resistances of Effeminate Gay Men in Education,El diablo en forma de gente - (r)resistencias de gays afeminados en la educación,El diablo en forma de gente – (r)resistencias de gays afeminados en la educación,,,Book,,Devires,,,,,,,,,,,,,–,,https://loja.metanoiaeditora.com/index.php?route=product/product&product_id=143
,,,Pajubá-terapia: ensaios sobre a cisnorma,2020,Sofia Favero,Pajubá-Therapy: Essays on Cisnormativity,Pajubá-Therapy: Essays on Cisnormativity,Pajubá-terapia: ensayos sobre la cisnorma,Pajubá-terapia: ensayos sobre la cisnorma,,,Book,,Editora,,,,,,,,,,,,,–,,
,,,Pedagogia da desobediência – travestilizando a educação,2020,Thiffany Odara,Pedagogy of Disobedience – Travestifying Education,Pedagogy of Disobedience – Travestilizing Education,Pedagogía de la desobediencia - travestizando la educación,Pedagogía de la desobediencia – travestilizando la educación,,,Book,,Devires,,,,,,,,,,,,,–,,
,,,Bajubá Odara – resumo histórico do nascimento do movimento de travestis no Brasil,2021,Jovana Baby Cardoso da Silva,Bajubá Odara – A Historical Summary of the Birth of the Transvestite Movement in Brazil,Bajubá Odara – A Historical Summary of the Birth of the Travesti Movement in Brazil,Bajubá Odara - resumen histórico del nacimiento del movimiento travesti en Brasil,Bajubá Odara – resumen histórico del nacimiento del movimiento de travestis en Brasil,,,Book,,FONATRANS,,,,,,,,,,,,,–,,https://www.institutolangage.com.br/produto/o-corpo-da-roupa-2/
,,,Corpos transitórios: narrativas transmasculinas,2021,Bruno Pfeil,Transitory Bodies: Transmasculine Narratives,Transitory Bodies: Transmasculine Narratives,Cuerpos transitorios: narrativas transmasculinas,Cuerpos transitorios: narrativas transmasculinas,Nicolas Pustilnick,Nathan Victoriano,Book,Compilation,Devires,,,,,,,,,,,,,–,,https://www.queerlivros.com.br/por-inflexoes-decoloniais-de-corpos-e-identidades-de-genero-inconformes-uma-analise-autoetnografica-da-cisgeneridade-como-normatividade?srsltid=AfmBOoqiSdfREGp0ofmqG4VkB_B5EbD5OHu8SBvegGmLxgZgOBxnznZQ
,,,"Esse sangue não é de menstruação, mas de transfobia",2021,Maria Lucas,"This Blood Is Not Menstruation, But Transphobia","This Blood Is Not Menstrual, but Transphobic","Esta sangre no es de menstruación, sino de transfobia","Esa sangre no es de menstruación, sino de transfobia",,,Book,,Urutau,,,,,,,,,,,,,–,,
,,,Ex/orbitâncias: os caminhos da deserção de gênero,2021,Abigail Campos Leal,Ex/Orbits: The Paths of Gender Desertion,Ex/Orbitances: Pathways of Gender Desertion,Ex/orbitancias: los caminos de la deserción de género,Ex/orbitancias: los caminos de la deserción de género,,,Book,,GLAC edições,,,,,,,,,,,,,–,,
,,,Não vão nos matar agora,2021,Jota Mombaça,They Won't Kill Us Now,They Won’t Kill Us Now,No nos van a matar ahora,No nos van a matar ahora,,,Book,,Cobogó,,,,,,,,,,,,,–,,
,,,Transfeminismo,2021,Letícia Carolina Nascimento,Transfeminism,Transfeminism,Transfeminismo,Transfeminismo,,,Book,,Jandaíra,,,,,,,,,,,,,–,,
,,,Transmasculinidades negras: narrativas plurais em primeira pessoa,2021,Bruno Santana,Black Transmasculinities: Plural First-Person Narratives,Black Transmasculinities: Plural First-Person Narratives,Transmasculinidades negras: narrativas plurales en primera persona,Transmasculinidades negras: narrativas plurales en primera persona,Leonardo Peçanha,"Vércio G. Conceição ",Book,Compilation,Ciclo Contínuo Editorial,,,,,,,,,,,,,–,,
,,,Fernanda Benvenutty: uma política travesti,2022,Fernanda Benvenutty,Fernanda Benvenutty: A Travesti Politics,Fernanda Benvenutty: A Travesti Politician,Fernanda Benvenutty: una política travesti,Fernanda Benvenutty: una política travesti,Silvana Nascimento,Lux Lima,Book,,Patuá,,,,,,,,,,,,,–,,
,,,Mais uma casa de bonecas,2022,Maria Lucas,Yet Another Dollhouse,Another Dollhouse,Una casa de muñecas más,Otra casa de muñecas,,,Book,,Urutau,,,,,,,,,,,,,–,,
,,,Manifesto transpofágico,2022,Renata Carvalho,Transphagic Manifesto,Transphagic Manifesto,Manifiesto transfágico,Manifiesto transpofágico,,,Book,,editora monstra,,,,,,,,,,,,,–,,
,,,Pedagogias das travestilidades,2022,Maria Clara Araújo,Pedagogies of Travestilidades,Pedagogies of Travestilities,Pedagogías de las travestilidades,Pedagogías de las travestilidades,,,Book,,Civilização Brasileira,,,,,,,,,,,,,–,,
,,,Psicologia suja,2022,Sofia Favero,Dirty Psychology,Dirty Psychology,Psicología sucia,Psicología sucia,,,Book,,Devires,,,,,,,,,,,,,–,,
,,,Quando o sol aqui não mais brilhar: a falência da negritude,2022,Castiel Vitorino Brasileiro,When the Sun No Longer Shines Here: The Bankruptcy of Blackness,When the Sun No Longer Shines Here: The Collapse of Blackness,Cuando el sol aquí ya no brille: la quiebra de la negritud,Cuando el sol ya no brille aquí: la quiebra de la negritud,,,Book,,n-1 edições,,,,,,,,,,,,,–,,
,,,Travestilidades e escolas nas narrativas de alunas travestis,2012,Adriana Sales,Travestilidades and Schools in the Narratives of Travesti Students,Travestilities and Schools in the Narratives of Travesti Students,Travestilidades y escuelas en las narrativas de alumnas travestis,Travestilidades y escuelas en las narrativas de alumnas travestis,,,Dissertation/Thesis,Master's Thesis,,,Universidade Federal do Mato Grosso,UFMT,Educação,Education,Educación,,,,,,,Link,,
,,,O corpo da roupa: a pessoa transgênera entre a transgressão e a conformidade com as normas de gênero,2014,Leticia Lanz,The Body of Clothing: The Transgender Person Between Transgression and Conformity with Gender Norms,The Body of Clothing: The Transgender Person Between Transgression and Conformity to Gender Norms,El cuerpo de la ropa: la persona transgénero entre la transgresión y la conformidad con las normas de género,El cuerpo de la ropa: la persona transgénero entre la transgresión y la conformidad con las normas de género,,,Dissertation/Thesis,Master's Thesis,,,Universidade Federal do Paraná,UFPR,Sociologia,Sociology,Sociología,,,,,,,Link,,
,,,Por inflexões decoloniais de corpos e identidades de gênero inconformes,2015,Viviane Vergueiro,Through Decolonial Inflections of Nonconforming Genders and Bodies,For Decolonial Inflections of Nonconforming Bodies and Gender Identities,Por inflexiones decoloniales de cuerpos e identidades de género no conformes,Por inflexiones decoloniales de cuerpos e identidades de género inconformes,,,Dissertation/Thesis,Master's Thesis,,,Universidade Federal da Bahia,UFBA,Cultura e Sociedade,Culture and Society,Cultura y Sociedad,,,,,,,Link,,
,,,Xica Manicongo: a transgeneridade toma a palavra,2019,Jaqueline Gomes de Jesus,Xica Manicongo: Transgenderhood Takes the Floor,Xica Manicongo: Transgenderity Speaks,Xica Manicongo: la transgeneridad toma la palabra,Xica Manicongo: la transgeneridad toma la palabra,,,Paper,Journal Article,,ReDoc,,,,,,,,,,,,Link,,
,,,Crianças e adolescentes trans. A construção de categorias entre profissionais de saúde,2020,Júlia Pontes,Trans Children and Adolescents: The Construction of Categories Among Healthcare Professionals,Trans Children and Adolescents: The Construction of Categories Among Health Professionals,Niños y adolescentes trans. La construcción de categorías entre profesionales de la salud,"Niños, niñas y adolescentes trans: la construcción de categorías entre profesionales de la salud",Cristiane Gonçalves Silva,Eunice Nakamura,Paper,Journal Article,,"Sexualidad, Salud y Sociedad",,,,,,,,,,,,Link,,